barkod;naziv
"8690604013210";"Flormar Enamel lak za nokte 321"
"3700306922736";"Couleur Caramel Volumising Brown mascara N73"
"5413149644021";"Ariel Touch Of Lenor 2kg"
"737052739120";"James Bond 007 Quantum EDT muški parfem 30ml"
"8300694640462";"Pompea Twin 20 Claro 4 L čarape"
"4005808817726";"NIVEA MEN Protect & Care krema za brijanje 100gr"
"800897839482";"NYX Professional Makeup Olovka za usne Slide On 09-Summer Tease"
"8606003061417";"Filter čaj Žalfija"
"3401345569585";"Abcderm Hydratant 200ml"
"681619806735";"The Balm Mad Lash maskara 1kom"
"5900273125941";"Colgate cetkica 360° Max White One"
"8607000034800";"Kurkuma plus zglob fit"
"3423475947059";"Issey Miyake Pleats Please Woman ženski parfem EDT 30ml"
"5205122000746";"Pharmasept umirujuća krema za osetljivu kožu 150ml"
"8034023228020";"Tref Line šnala 228020"
"8710103694069";"Varalica Mix dečak/devojčica"
"074312821202";"Natural Wealth Selen"
"8606106129885";"Aura Explicit farba za kosu 6.77"
"7322540061468";"Zewa Deluxe papirne maramice 10 komada"
"7310794282005";"Libresse Classic dnevni ulošci"
"4031244753618";"Humana mlečna kašica za laku noć 250 gr"
"3574660030334";"Johnsons dečiji gel za tuširanje"
"800897140861";"NYX Professional Makeup Metalik gliter 05-Lumi-Lite"
"5011417566602";"Scholl Light Legs Black 60Den XL"
"3600540337450";"Garnier Color Naturals 8.1 farba za kosu"
"3574660156409";"Neutrogena 2 in 1 maska i gel za lice"
"5949031303511";"Vanish Gold Oxy odstranjivač fleka"
"5410076390656";"Aussie Color Mate 3minute pakovanje za farbanu kosu 250ml"
"3390150568107";"Payot my payot serum za blistav ten sa ekstraktom gođi i akai bobicama i vitaminom C 30ml"
"3760049893106";"Biofar 27 Vitamini i Minerali"
"074312832703";"Natural Wealth ABC Junior Plus Vitamini za decu 100 komada"
"4001638098014";"Weleda neven pasta za zube 75ml"
"9000100968331";"Bref Duo Aktive Lemon WC osveživač"
"80100004641";"Revlon Super Lustrous ruž za usne 730"
"8606017875772";"Yesss! Еlastična gumica za kosu spirala 4kom"
"8008970043654";"Tesori Di Oriente Ayurveda parfem 100ml"
"9007253100670";"Bebivita sok banana, breskva i jabuka 200ml"
"8600102944350";"Atopik milky bath 200ml"
"4084500488465";"Old Spice Wolfthorn stik "
"5000204771039";"Glade mirisna sveca - Warm Spice"
"5200398511019";"Beautin Collagen mango-dinja 500ml"
"8606002721695";"Still Argan maska"
"8606107367606";"Aura All Year bronzer 911"
"3600521831465";"L'Oreal Casting Creme Gloss boja za kosu 1021"
"8058664058860";"Chicco Giotto Physio Air laža od silikona, plava 6-12 meseci"
"8433982007415";"Benetton Colors Purple Women Edt 50ml"
"4003583184231";"Fruttini losion za telo Experimental Mango"
"8691190466176";"GR Velvet Matte Lipstick NO: 17"
"8601900406231";"Juvitana kašica od baštenskog povrća sa junetinom 190g"
"4251232283754";"Catrice Prisma glaze sjaj za usne 030"
"4008600049180";"Nuk varalica kaučuk Blue"
"9000100805469";"Fa Shower + Losion gel za tuširanje 400ml"
"4059729039613";"Essence Cosmic lights lak za nokte 05"
"30121096";"Rimmel Super gel lak za nokte 012"
"3838824136424";"Schauma Repair regenerator za kosu"
"4005808811106";"NIVEA losion za uklanjanje šminke oko očiju 125ml"
"3052503810331";"Bourjoise olovka za obrve 03"
"4250587705454";"Essence Ink tečni ajlajner"
"3086123242517";"Bic 3 Flex B of 3"
"8712561546270";"Coccolino Creations Blue omekšivač za veš 1,9l"
"4084500394407";"Ariel Sensitive tečni deterdžent za veš 2,6l"
"882381073978";"Darphin Exuisage krema oko očiju i usana 15ml"
"8008970043630";"Tesori Di Oriente Ayurveda kupka 500ml"
"8600101643858";"Gynkgobil®"
"5997321755366";"Vanish Oxi Action odstranjivač fleka"
"8606106817737";"Vulkan kutija velika - cveće"
"8606017870463";"VZK Univerzalna krema 100ml"
"8002030116456";"Pronto Legno Pulito - za drvene površine"
"3600523214549";"Loreal Elseve Clay Šampon za kosu 250 ml"
"3661434001079";"Uriage hyseac A.I."
"4018852016984";"Bebivita više vrsta voća 90gr"
"3614223395538";"Rimmel Moisture Renew ruž za usne 370"
"8002140050206";"Cera di Cupra Krema za osetljivu kožu"
"4001638080309";"Weleda Ulje za lice od badema"
"5010622005012";"Oral B Mint konac za zube"
"3264680005145";"Nuxe nežan tonizirajući losion za lice 200 ml"
"4005808804344";"Nivea Sun losion sprej posle sunčanja"
"900071034";"Biokap farba za kosu 8.0"
"800897156046";"NYX Professional Makeup Tečni mat ruž za usne Soft Matte 58-San Francisco"
"5000204966312";"Duck Fresh Discs wc osveživač okean 36ml"
"4250338423828";"Essence Soft Touch 04 tečni puder"
"8001090698346";"Pampers Splashers Cp 3 Midi pelene za bebe 12kom"
"7612412003963";"Curaprox CS 3960 3/pack četkica za zube"
"3522930001874";"Caudalie Resveratrol krema za zonu oko oka 15ml"
"8606107686899";"Herbiko K2D3 junior sa kompleksom vitamina B, kapsule 20 komada"
"4016369636015";"Parusan šampon za žene 200ml"
"9000101092202";"Fa Bali kiss dezodorans u spreju 150ml"
"3600523589807";"L'Oreal Paris Colorista Spray  Rose Gold Hair "
"64642022967";"Jamieson C 500 mg kaspule sa vremenskim otpuštanjem 100 komada"
"4015400006770";"Always Ultra Normal Duo ulošci 20 kom"
"3052503824802";"Bourjois Contour Clubbing 48 olovka za oči"
"5201314056393";"STR8 Original mini muški dezodorans 50 ml"
"8600931007189";"Poklon Paket Natural Ljubičasti"
"8009518058031";"Deborah četka za tečni puder"
"800897840273";"NYX Professional Makeup Tečni kremasti ruž za usne Suede 07-Sandstorm"
"882381034887";" Darphin gel protiv podočnjaka i naduvenih kapaka 15ml"
"8009518305524";"Deborah Extra mat perfection tečni puder 2"
"3600541488014";"Garnier Deo Men Protection 6 Sprej 150ml"
"5900516311643";"Bella Teens Panty Energy dnevni ulošci 20 komada"
"3850105106032";"Ornel Baby Soft omekšivač za veš"
"8017331049013";"L'angelica Sensitive pasta za zube 75g"
"9000100722117";"Schauma Cream & Oil regenerator za kosu"
"83078003005";"Carmex Classic teglica 7.5g"
"3600522638032";"L'Oreal Paris Elseve Arginine Resist Light šampon za kosu, 250ml"
"8606019175528";"LLUMS koso sečena ajlajner četkica E08 1kom"
"96003398";"Dove Aqua Impac dezodorasn stick"
"8606017878322";"LLUMS paleta senki Matt Lilacs"
"7317400013114";"Tepe Interdental Blister 0.45mm Extra soft"
"4008576315272";"Titania četka za kosu"
"3574660529180";"Neutrogena Dry Sensitive mleko za telo"
"5010123714383";"Listerine Teeth&Gum voda za ispiranje usta 500ml"
"86032391";"Aura Divine Eyes senka 71 "
"9000100498548";"Vademecum Menthol Fresh paste za zube"
"8607000052354";"Voćni čaj aronije u filter kesicama, 80gr"
"86028974";"Aura Velvet Ton 11A farba"
"4005808246601";"Nivea Express Hydration losion za telo"
"5201314081517";"Bioten balzam za usne Aloe Vera 4.8g"
"8606019175252";"Velnea maska za oporavak kose 2x6ml"
"3838824171289";"Palette Pnc boja za kosu 400 "
"3600531505844";"Maybelline New York Color Sensational Shine Compulsion 130 ruž za usne"
"86012249";"Aura Velvet Ton 5.62 farba"
"9005800290843";"NIVEA noćna krema protiv bora za zatezanje kože 45+ 50ml"
"5201314941026";"Fino aluminijumska folija"
"8717185385632";"Society hairspray forte design lak za kosu"
"8718951001374";"Palmolive So Vibrant gel za tuširanje 250 ml"
"800897116200";"NYX Professional Makeup Kremasti ruž za usne Round 569-Snow White"
"5310001235468";"Becutan omekšivač za veš 1L"
"8712400716604";"Aptamil AR, 400 gr"
"8606106129922";"Aura Explicit farba za kosu 7.66"
"9000101202847";"Live Color xxl Ub097 morska sirena farba za kosu"
"4008455048413";"Dr.Beckmann čistač tepiha"
"86034524";"Aura Amazingly Resistant lak 421"
"9005800311289";"Nivea Anti wrinkle noćna krema za lice 65+ 50ml"
"4005808627233";"NIVEA MEN Pure Impact gel za tuširanje za muškarce 250ml"
"9000100733618";"Fa Men Xtreme Polar roll on"
"5201314069577";"Bioten Cellufight Cryo gel protiv celulita"
"3401399373817";"Bioderma Atoderm PP ultra hranjlivi emolijentni 200ml"
"8606014796759";"Moe28 Ultra tanki dnevni ulošci"
"8003350533800";"Cotoneve blaznice sa aloe verom"
"800897839413";"NYX Professional Makeup Olovka za usne Slide On 02-Bedrose"
"800897097318";"NYX Professional Makeup Olovka za obrve Precision Brow 07-Charcoal"
"4251232280289";"Catrice te blush flush cushion powder rumenilo C02"
"42315940";"NIVEA anti-age krema za ruke 100ml"
"3360373063697";"Cacharel Amor Amor Woman Edt ženski parfem 30ml"
"3600541151505";"Garnier Mineral Men Invisi Black dezodorans"
"86038843";"Aura Explicit 6 farba za kosu + gratis olovka"
"3600540337528";"Garnier Color Naturals 5.3 farba za kosu"
"3414206010423";" Joop Homme EDT muški parfem 30ml"
"3600530559756";"Maybelline Color Sensational ruž 530"
"8600618015117";"Oligogal® Cr kapsule"
"5000386004628";"Revlon Charlie Blue EDT ženski parfem 100ml"
"8009518227024";"Deborah Absolute Lasting 06 ruž za usne"
"8001090197610";"Head&Shoulders Nourishing šampon protiv peruti 225ml"
"4251232262919";"Essence The gel lak za nokte 102"
"8008843004379";"Prosterbe"
"9000100625135";"Bref Aktiv Ocean WC osveživač"
"5901761966671";"Eveline Oh my lips liquid tečni ruž i olovka za usne 01 Natural nude"
"9000100760546";"Fa Xtreme Invisible dezodorans"
"8606105480604";"MOE28 Super tamponi 16 komada"
"3838824256603";"Palette Deluxe boja za kosu 760 Dazzling Brown "
"5021044024345";"Maybelline Hydra Extreme ruž 535"
"8712400714259";"Aptamil Allergy Digestive Care"
"80893622";"Neutro Roberts Invisible roll on 50ml"
"9005800267340";"Nivea Cream Care krema za čišćenje lica 150ml"
"8710103854425";"Avent Premium magična šolja plava 12+ 260ml"
"8606013479394";"C-thru Pure Illusion dezodorans sprej 150ml + gratis"
"8718951026865";"Colgate Slim Soft White četkica za zube 1+1 gratis"
"5901761956597";"Eveline Lip therapy 8u1 hijaluronski filer sa kolagenom 12ml"
"50785872";"Gillette Series Cool Wave muški deozodorans gel 70 ml"
"309975415094";"Revlon Colorstay tečni puder za normalnu i suvu kožu 330"
"8003520013040";"Palmolive tečni sapun Aquarium 300ml"
"8009518178364";"Deborah 06 olovka za usne"
"8717185381443";"Keune Tinta Color boja za kosu No.6"
"3600550304398";"Mixa krema protiv crvenila, 50ml"
"8051403091142";"Innamore Day 15 Miele 3 čarape"
"9005800273464";"NIVEA micelarna voda za osetljivu kožu 400ml"
"8606017876076";"Velnea Fresh tečni sapun 1000ml"
"3600531363857";"Maybelline New York Color Sensational Matte Nudes 986 Melted Choc "
"3600522833161";"L'oreal False Lash Superstar 01"
"4251232244571";"Essence Ultra last instang colour ruž za usne 07"
"86033527";"Aura mat ruž 608"
"8606013474382";"STR8 Sensitive poklon set (losion posle brijanja 50 ml + dezodorans u spreju 150 ml)"
"3800034952330";"Areon Jabuka i cimet jelkica"
"9000101020625";"FA sapun Vitalizing 90g"
"8691190643133";"Golden Rose Ice Color nail lacquer No.113 lak za nokte 6ml"
"8606019173500";"21 Lak za nokte 4 11ml"
"3052503231327";"Bourjois  ruž za usne 13"
"3600530730308";"Maybelline Master Drama ajlajner"
"3401340981023";"Bioderma Sensibio Tolerance+ krema za lice 40ml"
"4603014001092";"Splat Biocalcium – za jačanje zubne gleđi i kompletnu negu"
"8606017877028";"Velnea krema protiv ispucalih peta 100ml"
"6920354822421";"Colgate Naturals Sharcoal pasta za zube 75ml"
"5201314090571";"Bioten vanila losion za telo 250ml"
"8606014796636";"Velnea dezodorans sprej za stopala"
"8600101515308";"Laxomucil"
"800897097257";"NYX Professional Makeup Olovka za obrve Precision Brow 01-Blonde"
"8606019175023";"Velnea šampon za negu plave kose farbane ili prirodne 1000ml"
"42157724";"Nivea Creme soft gel za tuširanje 50 ml"
"5901761940947";"Eveline Mini Max lak za nokte 191 5ml"
"6009661219763";"Labello Breskva balsam 4.8g"
"8051403105634";"Lilly čarape 15 Den Light sand 5"
"3414201002683";"Jil Sander Sun Woman Edt ženski parfem 75ml"
"7640170370010";"Biomed propoline pasta za zube 100g"
"800897822217";"NYX Professional Makeup Maskara za oči Super Luscious 07-More To Love"
"8051403105696";"Lilly čarape 15 Den Nero 3"
"8009518165104";"Deborah 12 sjaj za usne"
"4744183011298";"Natura Siberica severni detoks sapun za dubinsko čišćenje, 100ml"
"3600520434674";"L'Oreal Paris Elseve Color Vive maska za kosu, 300ml"
"3052503231723";"Bourjois  ruž za usne 17"
"5012583203506";"Live Color XXL Ultra Bright boja za kosu 94"
"7612412140002";"Curaprox CPS 14 regular interdentalne četkice"
"800897838522";"NYX Professional Makeup Četkica za blendovanje 09"
"3379501220963";"Solinotes Rose Edt 50ml"
"8003510006465";"Malizia Bonbons lemon energy dečiji dezodorans 75 ml"
"3600522377306";"LÓreal Paris Excellence 6.32 Boja za kosu"
"8691190643843";"Golden Rose Ice color nail lacquer No.184 lak za nokte 6ml"
"4084200654009";"Maybelline Crayon Expression olovka 40"
"3600530462797";"Maybelline Affinitone puder 30"
"8606017875796";"Yesss! Elastična gumica za kosu 12kom"
"96101308";"Max Factor Clr Intnsfyng Balm 15 Posh Poppy"
"5410076659296";"Head & Shoulders Apple šampon za pranje kose 400 ml"
"3600523371112";"L'Oreal Paris Botanicals Safflower Maska za suvu kosu 200ml"
"8691190960407";"GR Wow Nail Color  NO: 40"
"8606102846144";"Good bye kilogrami"
"4056800895410";"Wellaton 12/0 extra light"
"3614224874421";"Bourjois 1 Seconde Pink positive lak za nokte 12"
"5901330034725";"Olimp Labs Vita-min plus senior, 30 kapsula"
"3052503420127";"Bourjois Rose Gloss sjaj za usne"
"3600531320065";"Maybelline Lash Sensational  Luscious 07 Very Black maskara"
"7891024123126";"Colgate pasta Max White "
"4103040022868";"Sebamed Pro! dnevna krema za regeneraciju kože 50ml"
"9000101060850";"Color Expert boja za kosu 3.0 "
"4017645016996";"Logona Age Protection hidro lipid balans "
"8001280404887";"Felce Cool Blue poklon set"
"8606017878049";"LLUMS Blush&Highlighter Baked Duo 102 Perfect Match"
"3838824083704";"Taft Volumen pena za kosu 200ml"
"3504105000080";"Mustela penasti šampon za temenjču, 150ml"
"30120655";"L'Oreal Color Rich lak za nokte 224"
"4005808837311";"NIVEA Pearl & Beauty sprej 150ml"
"3600541991170";"Garnier Fructis Oil Repair 3 Maska za kosu 300 ml"
"3600550894004";"Mixa Atopiance mleko za telo 400 ml"
"8714789939834";"Palmolive gel za tuširanje za muškarce Guarana Kick Brasil 250ml"
"4014871027772";"Lama Max motion 500g kajsija/mango"
"96101315";"Max Factor Clr Intnsfyng Balm 20 Liscious Red"
"8001090544407";"Pantene Micellar regenerator u spreju za kosu 150ml"
"9005800281766";"NIVEA Oil Pearls kremasti gel za tuširanje sa uljanim perlama i cvetom lotosa 250ml"
"8691190608033";"Golden Rose 03 senka za oči u olovci"
"3700306921098";"Couleur Caramel olovka za oči i usne 109 Brown"
"3600541094352";"Garnier Deo Mineral Men Stik (40 ml) Xtreme Ice"
"8606003130342";"Axel Kal protiv kamenca"
"8718375520857";"Keune Tinta Color boja za kosu No. 7.46"
"8606019893934";"Faro farba za kosu 7.2 lešnik plava"
"8300694505419";"Pompea Vani 15 Nature 1/2-S čarape"
"8606011741790";"Grozozo gel "
"83800002795";"7th Heaven Dea Sea Mud Pak"
"5901086006137";"Teekanne Narandža i đumbir čaj"
"8606108015773";"Deborah Set Milano Red dugotrajni ruž za usne 13+gratis super gloss sjaj"
"3700306921470";"Couleur Caramel olovka za usne 147 Ruby red"
"9000100840743";"Syoss Oleo Intense boja za kosu 3-10 "
"9000100448086";"Dečji sapun sa bademom i mlekom"
"5052197046663";"Scholl Light Legs Biege 20Den M"
"8690604379903";"Flormar Full color nail enamel lak za nokte"
"5202663230014";"Herbal jednonedeljne ampule za kosu"
"3838824159133";"Palette Icc boja za kosu A10 Ultra Ash Blond  "
"5011321968721";"Max Factor Bronzing Powder Golden 01"
"8606106817782";"Vulkan kutija mala - liciderska srca"
"8606002723644";"Still Popart boja za kosu 91"
"8600272033311";"Becollino kupka za bebe"
"8606017876472";"LLUMS olovka za oči - Caffe latte"
"96138311";"Max Factor Colour Elixir olovka za usne"
"8606107367118";"Aura olovka za oči 87"
"5943048003211";"Bioten 24h hidrirajuća dnevna krema za normalnu i kombinovanu kožu lica 50 ml"
"4251232235180";"Essence Colour Boost lak za nokte 09"
"8691190083182";"Golden Rose Eyeliner 318"
"96101285";"Max Factor Clr Intnsfyng Balm 05 Sumptuous Candy"
"9000100926690";"Gliss Serum Deep šampon za kosu 400ml"
"5997321758701";"Airwick Fm radost letnjeg jutra osveživač prostora dopuna 250ml"
"3600523192830";"L'Oreal Paris Magic Retouch sprej za privremeno prikrivanje izrastka 3 Brown"
"8606017873990";"Velnea Kids gel za tuširanje za devojčice 250ml"
"3600521935088";"L'Oreal Casting Creme Gloss boja za kosu 515"
"8606014799903";"Moe28 Multistyle dnevni ulošci 40kom"
"8606108353318";"Swoon Beauty Blender sunđer, 1 komad"
"800897016821";"NYX Professional Makeup Tečna senka za oči 04-Gold Standard"
"3614223912216";"Bourjois Khol olovka za oči Contour Sharpener"
"8606017970675";"Still vikler - spirala"
"800897179373";"NYX Professional Makeup Set za oči i usne Sprinkle Town Shimmer Eye & Lip Set"
"074312864711";"Natural Wealth B Complex"
"8411126033858";"Revlonflex balzam za kosu all types, 650ml"
"4056800619726";"Wellaton 6/73 maxi single"
"3600541116313";"Garnier Miracle Skin krema"
"3600523612901";"L'Oreal Paris Casting Creme Gloss 513 Iced Truffle"
"4023103083943";"Vileda puractive sunđer  2 komada"
"8411114001432";"Woman'Secret Sweet Tempatiton Apple EDT 40ml"
"4056800657346";"Wellaton 4/0 medium brown"
"8606014796735";"Mamma&Baby pelene Newborn 1, 28 komada"
"8691190856113";"Golden Rose Longstay Liquid Matte ruž za usne 11"
"3614225979910";"Bourjois Rouge velvet the lipstik ruž za usne 017"
"3574660215540";"Johnsons Baby šampon za kosu"
"4005800631719";"Eucerin Balsam za negu i regeneraciju usana"
"9000101019445";"FA sapun Yoghurt Sensitive 90g"
"3600523294985";"LÓreal Paris Superstar XFiber Black Maskara"
"3052503810836";"Bourjoise olovka za obrve 08"
"3600521114629";"L'Oreal Color Riche Naturals 235 ruž"
"3600521374801";"L'Oreal Paris Excellence 8.13 boja za kosu"
"86031868";"Aura Glorious Cheeks rumenilo 214"
"4062300035096";"Hipp Voćni užitak kruška i jabuka 90gr"
"3282779003124";"Avène termalna voda 150ml"
"8691190120733";"Golden Rose Correct & Conceal Cammouflage Cream palette"
"3600520076560";"L'Oreal Color Riche Crayon Khol 107 olovka"
"3508240002930";"Lierac Premium promo svileknasta krema za lice 30ml"
"8411061291580";"Mediterraneo muški dezodorans"
"86038294";"Aura Ultimatte 910 Au Naturel mat tečni ruž"
"3337872413063";"La Roche Posay Redermic R intenzivni korektor 30ml"
"3574661163468";"Le Petit Marseillais cvet narandže čvrsti sapun"
"3800034954808";"Areon Eukaliptus eterično ulje 10ml"
"50683352";"Max Factor Lasting Performance Pastelle 102"
"681619800610";"The Balm rumenilo Pinstripe"
"86036474";"Aura Glorious Cheeks rumenilo 226"
"3605473505990";"John Galliano Perlez-Moi D'Amour Encore Woman EDT ženski parfem 80ml"
"8606017871743";"LLUMS Lak za nokte - GE Turquoise"
"5052197046724";"Scholl Light Legs Biege 20Den xl"
"8710505046107";"Chicopee Mikrofiber plus krpa - Žuta"
"8606017875765";"Yesss! Еlastična gumica za kosu spirala 4kom"
"309978161066";"Revlon Ultra HD Matte tečni ruž za usne 600"
"8606102846038";" Jabukovo sirće + Vitamin C kapsule"
"3600522779124";"L'Oreal Excellence 10.13 boja za kosu"
"3831070650393";"Afrodita Clean Phase micelarni rastvor 3u1 200 ml"
"42236726";"NIVEA Stress Protect stik 40ml"
"5901086001231";"Teekanne čaj sa nanom i limunom 30 gr"
"8606106129984";"Aura olovka za usne 52"
"4008576304511";"Titania skidač žuljeva + rende"
"3574660536935";"RoC micelarna voda za čišćenje lica i očiju"
"8606019170813";"Yesss! Ukrasna kesa crna sa srcima"
"3251241047683";"Le Petit Marseillais regenerator za kosu"
"8003670815778";"Lycia Savšen dodir trake za depilaciju lica 20kom"
"8606107403052";"Lavanda ulje 10ml"
"3014260313302";"Gillette Blue II Excel Brijač 1/1"
"3600541474499";"Garnier Deo Protection 6 Cotton Fresh Roll-on 50ml"
"8607000139246";"Dr Colić Premium maska za lice + gratis  Dr Colić hidrantna maska za lice"
"3700306910443";"Couleur Caramel senka za oči 044 Pearly Plum Brown"
"5021265231102";"Feroglobin sirup"
"4005808252190";"NIVEA Q10 losion za zatezanje kože sa Vitaminom c 250ml"
"8606017870395";"VZK Losion za čišćenje problematične kože 100 ml"
"5902101515115";"Venita jednokratni sprej za farbanje kose - Pink Word 8"
"737052592466";"Bruno Banani Dangerous Women EDT ženski parfem  20ml"
"6944944000990";"Innamore Microfibra 70 Nero 3 čarape"
"3600541946705";"Garnier Skin Naturals Tissue Mask  - Moisture+ Freshness Maska za lice u maramici 32 gr"
"3605520301483";"Giorgio Armani Attitude EDT muški parfem 30ml"
"8606017878582";"LLUMS puder za lice True skin Almond"
"3700306922743";"Couleur Caramel Volumising Blue mascara N74"
"4059729030184";"Catrice Iconails gel lak za nokte 59"
"8058664008469";"Chicco laža Physio Air od silikona, 0m+, 2 kom u kutiji, roze"
"8058664057429";"Chicco Giotto staklena flašica, silikon, unisex 0m+"
"4710962406005";"Farlin pojas za majke XL"
"5052197035445";"Scholl Velvet Smooth extra coarse turpija za pete refill dopuna"
"3574661163475";"Le Petit Marseillais Vanila čvrsti sapun"
"309975764024";"Revlon olovka za obrve Brunette"
"3614224525132";"Rimmel Magnif"
"3838824090054";"Vademecum Apple dečja pasta za zube"
"4104260157118";"Swiss O–Par  Frotee šampon za suvo pranje kose"
"8698605069830";"Remove pre depilacijske maramice 20kom"
"3614223132645";"Rimmel Oh My Gloss Oil Tint sjaj za usne 200"
"882381147013";"Darphin  maska za lice od zelene gline 50ml"
"5901887039839";"Ziaja Jasmin serum protiv bora 30ml"
"4015400274780";"Pampers Premium Care, Midi Veličina 3"
"8606105480888";"Velnea Repair šampon za kosu"
"3614226291967";"Max Factor Radiant lift korektor 001 Fair"
"8059147053174";"Chicco bm kupka i šampon 750ml"
"8606002728373";"Still Color šampon 326"
"3661434000515";"Uriage termalna voda 150ml"
"800897846237";"NYX Professional Makeup Tečni duo za konturisanje lica Sculpt&Higlight 02-Almond/Light"
"5201314070498";"BU Golden Kiss dezodorans"
"8606017871149";"Dent-a-dent Multihead Soft četkica za zube 1 komad"
"8710447273593";"Rexona Oxygen Fresh gel za tuširanje 250ml"
"800897142926";"NYX Professional Makeup Tečni mat ruž za usne 11-Milan"
"8003350527472";"Cotoneve sunđer od celuloze i pamuka"
"4015400674023";"Pampers Pants pelene za bebe, Veličina 6, 44 kom"
"9000100944953";"Syoss Renew 7 regenerator za kosu"
"3600541611672";"Garnier Olia 5.60 farba za kosu"
"8014002000861";"Casaclean vlažne maramice za drvo"
"3760049891034";"Biofar Kids Multivitamin"
"3600522820604";"L'Oreal Paris micelarna voda"
"3337875517300";"La Roche Posay Cicaplast balsam SPF50"
"3600541912588";"Garnier Olia 112 farba za kosu"
"4251232253863";"Catrice Velvet Matt ruž za usne 080"
"8051403105573";"Lilly čarape 15 Den Light sand 3"
"8710103845997";"Avent Cucla ultra air deco za dečake 0-6m 2kom"
"8714789514642";"Palmolive Thermal Spa Mineral Massage gel za tuširanje  500 ml"
"3871267011569";"Ovnak Latex sunđer za nanošenje pudera 2/1 SWNR-31"
"5201314070337";"BU Golden Kiss Natural ženski sprej za telo 75 ml"
"5943048003372";"Bioten hidrirajući losion za telo"
"8710505996501";"Chicopee Lavette super višenamenska krpa - Crvena"
"4001638099950";"Weleda ulje za telo od pasjeg trna"
"42206996";"Nivea Šampon protiv peruti za farbanu kosu"
"9000101045901";"Vademecum 2u1 Advanced Clean pasta za zube 75 ml"
"3337875550628";"La Roche Posay Anthelios dečije mleko SPF 50+ 250ml"
"4001638086004";"Weleda Dnevno-noćna krema za lice od badema za suvu kožu"
"8691190960209";"GR Wow Nail Color  NO: 20"
"9000101056198";"Schauma šampon za kosu Succulent raspberry&sunflower oil 400ml"
"4084500148901";"Head & Shoulders Thick & Strong 2u1 šampon"
"8691109374912";"Tref Line kratke čarape mini maus veličina 5"
"8009518112719";"Deborah 24 Ore 1 tečni puder"
"8011003808953";"Moschino Pink Bouquet Woman Ženski parfem EDT 100ml  & BL 100ml"
"800897818449";"NYX Professional Makeup Tečni iluminator Born To Glow 02-Gleam"
"8606108015643";"Deborah 24Ore Absoulute Volume maskara + gratis Deborah Divine maskara"
"4744183010147";"Natura Siberica Oblephika balzam za sve oštećenu kosu 400ml"
"5997321757353";"Airwick Mist sprej Čari leta 210ml"
"4008576010283";"Titania turpija za nokte "
"96109823";"Max Factor Lipfinity Longlasting Alwys Elegant 70"
"4084500929494";"Pantene Smooth&Sleek regenerator za kosu 270ml"
"9000100920810";"Palette Perfect Care Color boja za kosu 800   "
"8606017875994";"Yesss! Šnalica za kosu sa mašnicom 3kom"
"4250947564929";"Essence 58 gel lak za nokte"
"8300081751986";"Golden Lady My Secret 20 čarape, Nero 2"
"8607000076350";"Garcinia Cambogia Maxi Fit - blister pakovanje sa 30 kapsula"
"3600531082703";"Maybelline Color Tattoo 97 senka za oči"
"3600523500239";"L'Oreal Paris True Match Korektor 4N Beige"
"9005800297156";"NIVEA MEN DEEP gel za brijanje 200ml"
"4250338414734";"Essence Long Lasting 09 olovka za oči"
"8003350503452";"Cotoneve 40 loptica od pamuka"
"8691190420642";"GR Perfect Finish Liquid Foundation  NO: 64 "
"8300497119943";"Golden Lady Vely 15 čarape, Nero 5"
"3600541923010";"Fructis Goodbye Damage šampon za kosu"
"9000100770361";"Syoss Oleo Intense regenerator za kosu"
"9005800309712";"Nivea poklon set (Creme gel za tuširanje 250ml + univerzalna krema 75ml + lufa)"
"9000101055313";"Schauma Multi repair 6 šampon za kosu 400ml"
"50287062";"Dove Deo Invisible Dry Stik 40ml"
"5201314161349";"BU Trendy ženska toaletna voda 50 ml"
"85805132125";"Elizabeth Arden Green Tea Cherry Blossom EDT Woman 100ml"
"3600522498193";"L'Oreal Paris Elseve Fibralogy maska za kosu, 300ml"
"5999518577553";"Aquafresh Standard četkica za zube"
"4005808861798";"Nivea Baby losion za pranje sa pumpicom 250ml"
