barkod;naziv
"3838824208930";"Schauma Intensive šampon za kosu"
"3600550368574";"Mixa Baby gel za tuširanje, 400ml"
"9000101059793";"Color Expert boja za kosu 7.0 "
"3600522638254";"L'Oreal Paris Elseve Arginine Resist Light sprej za kosu, 150ml"
"309971085024";"Revlon Nearly Naked kompaktni puder  NO:020"
"8606011741165";"Protect vitamin C"
"8606019894238";"Yesss! četka za kosu ovalna mint 9586-xp 1kom"
"22230190";"Lilly hidrogen 6% 120ml"
"4059729032010";"Catrice The little black one volume waterproof maskara 010"
"8606019172251";"Yesss! Lufa za kupanje plava L363 Blue"
"3600523019649";"L'Oreal Paris Elseve Extraordinary Oil krema za suvu kosu, 150ml"
"3600540578211";"Fructis šampon protiv peruti "
"3800003303880";"Supravit Vitamin C 1000mg pomoranža šumeće tablete 20kom"
"30107762";"Maybelline Colorama 325 lak za nokte"
"3349668520732";"Paco Rabanne 1 Million Intense muški parfem 50ml"
"9062300131168";"Hipp tikvice sa krompirom kašica 125g"
"8710103781974";"Avent magična šolja sa slamkom zelena 12m+ 300ml"
"3600521893500";"L'Oreal Volume Million Lashes Extra Black maskara"
"8001090802309";"Tide Alpine 3u1 kapsule za veš 12kom"
"4251232263084";"Essence Metal Shock prah za nokte 02"
"4744183010574";"Natura Siberica hranljivi šampon za veći volumen, 400ml"
"3800708382111";"Elea Profesional farba za kosu No 03.0 138ml"
"3600531505806";"Maybelline New York Color Sensational Shine Compulsion 55 ruž za usne"
"30121157";"Rimmel Super gel lak za nokte 042"
"3607340384738";"Rimmel Super lash wow maskara za oči"
"8606108022689";"Zorannah EDP ženski parfem 50ml"
"4251232284560";"Catrice Iconails gel lak za nokte 53"
"4251232284546";"Catrice Iconails gel za nokte 51"
"8009518092073";"Deborah Hi Tech 7 senka za oči"
"4005808808007";"NIVEA MEN Vitality Fresh muški gel za tuširanje 250ml"
"3858891531670";"La Roche Posay Lipikar Baume balzam za telo 200ml + Gratis Syndet 100ml"
"8600272022278";"Dahlia Uljani Skidač Laka Bez Acetona"
"5012874026043";"Rimmel olovka za oči 071"
"800897837419";"NYX Professional Makeup Senka za oči Prismatic 08-Blue Jeans"
"8034112290785";"Pompea Massage&Repose 30 Nature 4-L čarape"
"8691190990039";"GR Waterproof Automatic Eyeliner NO: 03"
"3600522550129";"L'Oreal Paris Age Expert 45+ Dnevna krema (50 ml)"
"50051239485";"Lip Smacker Disney Frozen Olaf balzam za usne 4g"
"3522930001898";"Caudalie Resveratrol noćna krema 50ml"
"3600531512606";"Maybelline New York Color Sensational Matte Metallics ruž za usne White Gold"
"30122109";"Rimmel Super Gel Red Instinct lak za nokte 002"
"4251232284539";"Catrice Iconails gel lak za nokte 50"
"30120679";"L'Oreal Paris Color Rich lak za nokte 330"
"86036443";"Aura Matte ruž za usne 714"
"4005800064999";"Eucerin Fluid za zaštitu osetljive kože od sunca SPF 50+"
"3850104280092";"Lino voćna kašica jabuka i banana, 190gr"
"3337875549622";"La Roche Posay Lipikar Lait 200ml "
"9000101202694";"Live Color XXL U73 metalik plava farba za kosu"
"9000101075588";"Gliss Supreme Fullness regenerator sprej 200ml"
"8606017876083";"Velnea White tečni sapun 500ml"
"3401341329688";"Bioderma Atoderm Intensive krema za suvu i osetljivu kožu 75ml"
"5319991668034";"Emuderm ulje 50ml"
"3600523347971";"L'Oreal Paris Lip Paint Lacquer 102 Darling Pink Tečni ruž"
"737052885131";"Bruno Banani Woman EDT ženski parfem 40ml"
"8600101839060";"Cedexbon Vitamin C tablete"
"9000101211221";"Pure Color 5.0 jednostavno smeđa farba za kosu"
"86034746";"Aura mat ruž 622"
"8606019175764";"VZK mleko za sunčanje SPF30 200ml"
"8606014794373";"Velnea gel za brijanje za muškarce za osetljivu kožu 200 ml"
"7610196023375";"Trisa Revital sensitive pasta za zube 75ml"
"8008843003853";"Hepadiet"
"8017331040812";"L'Angelica energetski gel za tuširanje 250ml"
"8003693403334";"Genera Argan tečni sapun - dopuna, 1000ml"
"8714462082307";"Body Resort Mango balzam za usne"
"3614224075958";"Rimmel Magnif""eyes double ended 006 senka + ajlajner"
"8606011741035";"Marisol isotonic sprej "
"8606108353110";"Swoon četkica za nanošenje senke"
"3600540337580";"Garnier Color Naturals 7.4 farba za kosu"
"9000100383370";"Perwoll Color Magic tečni deterdžent za veš 3l"
"8002140053108";"Cera di Cupra Vlažne maramice za čišćenje lica"
"8009518285147";"Deborah Duo Contour&Highlighter Olive Skin kontura i hajlajter u stiku"
"5201263082580";"Babylino Sensitive pelene Maxi 7-18kg 50kom"
"8606014795547";"Home&Family mikrofiber krpa za čišćenje"
"8606014799729";"Velnea Violet touch balzam za usne 10 ml"
"9000101053111";"Fa Divine Moments dezodorans 150ml"
"3600542072106";"Garnier Color Sensation 6.15"
"8606011746535";"Gumedići kalcijum + vitamin D"
"3607346626207";"Super Playboy ženska toaletna voda 30 ml"
"3614221205396";"Adidas dezodorans sprej Uefa II, 150ml"
"8009518325782";"Deborah 10 Days Long 883 lak za nokte"
"8606015842318";"Spin deterdžent za pranje posuđa Chamomile&Olive Leaf "
"3337871324315";"Vichy Dercos šampon za osetljivu kožu"
"3414206000608";"Joop Homme EDT muški parfem 125ml"
"3830001293548";"Afrodita Šampon za kosu i telo Med & Vanila 1000 ml"
"5202663042549";"Echo Farcom Revitalizing Hair Conditioner"
"3337872413711";"La Roche Posay Redermic C krema za suvu kožu"
"8411114078953";"Disney Paw Patrol figura Marchall gel za tuširanje 400ml"
"9000100922166";"Palette Perfect Care Color boja za kosu 390 "
"9000101018707";"Palette Delux boja za kosu 219 Platinum Pearl Blonde"
"8712561231237";"Dove Pistachio gel za tuširanje"
"3331438921207";"Salvador Dali Sea & Sun in Cadaques EDT ženski parfem 50ml"
"3607345064529";"Rimmel Stay Matte 003 kameni puder"
"3264680010163";"Nuxe My Dream Poklon set"
"5052197038126";"Scholl Gel Active ulošci za posao 38-42"
"7613035058460";"Bubchen šampon i gel za tuširanje"
"4251232218435";"Catrice Velvet Matt olovka za usne 050"
"86034074";"Aura Shine Excess ruž za usne 769 "
"4744183010130";"Natura Siberica oblepikha balzam  za kosu 400ml"
"9000100672658";"Taft sprej za zaštitu kose od toplote 250ml"
"3401397163496";"​​​​​​​Bioderma Cicabio krema 100ml"
"9005800309767";"NIVEA poklon set Care rose bag"
"8051403104972";"Lilly čarape 70 Den Coffee 3"
"380013220659";"Corega Fixative Extra Strong Mint krem"
"4005808867004";"NIVEA Essentials BB krema svetla nijansa 50ml"
"3052503900216";"Bourjois Smoky 2 senka za oči"
"8600931009183";"Multiactiv 3 koraka hijaluronska  hidrantna maska za lice 22ml"
"3800034954792";"Areon Čajno drvo eterično ulje 10ml"
"3838824102221";"Vademecum Express White pasta za zube"
"3607345380513";"Rimmel ruž za usne lasting finish lipstick"
"7702018479177";"Gillette poklon set "
"5045252667330";"Burberry Classic EDP ženski parfem 50ml"
"8606017872474";"LLUMS Lip Loving ruž za usne - 10 Fuchsia Craze"
"3052503814230";"Bourjois Propelling ajlajner 42"
"3838824218557";"Palette Icc boja za kosu R2 Dark Mahogany "
"783320942044";"Bvlgari BVL II ženski parfem 25ml"
"8607000139284";"Dr Colić Sensitive noćna krema 50ml + gratis dnevna krema 50ml"
"5060045001337";"Nasalese Allergy"
"4015400481317";"Always Platinum Super Duo ulošci 12 kom"
"5011321338500";"Max Factor Miracletouch Natural 70"
"4008576387415";"Titania gel maska za lice 9140 1kom"
"4251232281385";"Essence Te wood you love me lak za nokte 02"
"4251232218411";"Catrice Velvet matt olovka za usne 030"
"9062300121398";"Hipp bundeva sa krompirom"
"5410076565986";"Pantene Repair & Protect šampon"
"8606017876960";"Yesss! Četka za kosu narandžasto plava 9716C"
"800897835422";"NYX Professional Makeup Rumenilo u kamenu High Definition 15-Pink The Town"
"800897837396";"NYX Professional Makeup Senka za oči Prismatic 06-Smoke&Mirrors"
"3838980515286";"Subrina Charm 85 farba za kosu"
"4251232218442";"Catrice Velvet matt olovka za usne 060"
"4015400703983";"Pampers Pants pelene za bebe, Veličina 3, 26kom"
"4744183010116";"Natura Siberica Oblephika balzam za sve tipove kose 400ml"
"4008576003667";"Titania pinceta Inox"
"4005808176755";"NIVEA Zeleni čaj i krastavac sapun 90 gr"
"8607000150807";"Pelo Cubano losion za kosu 200ml"
"42178590";"NIVEA Pure Effect piling za svakodnevno pranje 150ml"
"9000100921565";"Palette Perfect Care Color boja za kosu 658   "
"8600101839473";"Propolis sprej + bokvica"
"5011417571415";"Airwick fm zimska čarolija dopuna 250ml"
"309976012292";"Revlon ColorStay Gel lak za nokte 600"
"3700306915530";"Couleur Caramel rumenilo 053"
"3337875491525";"Vichy Idéalia nega za normalnu do mešovitu kožu 50ml"
"4005808449842";"Nivea Lokvanj i ulje sapun"
"688575006339";"Cerruti Image EDT muški parfem, 50ml"
"3052503301433";"Bourjois lak za nokte 14"
"3326240038076";"Urlic De Varens Silver EDT muški parfem 60ml"
"4005808812035";"NIVEA Essentials hidratantna noćna krema za normalnu kožu 50ml"
"800897813710";"NYX Professional Makeup Sprej za fiksiranje šminke 01-Matte 60 ml"
"3600530559879";"Maybelline Color Sensational ruž 630"
"085805506254";"Elizabeth Arden Pretty EDP ženski parfem 50ml"
"8001090026224";"Pantene Pro V Aqualight 360ml + Regenerator 200ml"
"8009518321579";"Deborah Maxi Terra lumi nature 03 rumenilo"
"6944944004547";"Incanto ženske sokne 39-40"
"4005800181047";"Eucerin DermoPure Micelarna voda za čišćenje masne kože 400ml"
"800897047474";"NYX Professional Makeup Mat puder za lice u kamenu Stay Matte But Not Flat 18.5-Deep Olive"
"3600541322134";"Garnier Skin Naturals Optical Blur 5 Sec Krema za lice i baza za šminku (30 ml) "
"8001280029844";"Felce Azzurra Benessere Karite dezodorans u spreju, 150ml"
"5201314152903";"STR8 Oxygen roll on"
"8698605069786";"Remove Squeeze hladni vosak za depilaciju 100ml"
"3508240206833";"Lierac Liftissime noćna krema za popunjavanje bora 50ml"
"6944990086559";"Innamore Body Slim 40 Nero 5 čarape"
"7610196003544";"Colgate Zig Zag Flexi četkica za zube"
"8606011742414";"Marisol panthenol sprej"
"5907609399076";"Eveline CC Magical 50 tonirana krema"
"3052503780207";"Bourjois lak za nokte Top Coat"
"8606014798630";"Mamma&Baby sapun za bebe sa pantenolom"
"4005808805228";"NIVEA BABY krema za zaštitu od ojeda 100ml"
"3838952018814";"Paloma Mega troslojni kuhinji ubrusi 2 komada"
"4001638099943";"Weleda Opuštajuće ulje za telo od lavande"
"8001090590541";"Old Spice Lagon muški dezorodans u spreju 150ml"
"8606106857139";"Afrička šljiva 10 kom"
"3337871324186";"Vichy Idealia Pro krema za lice 30ml"
"3838944361751";"Supradyn Energy EFF"
"800897103125";"NYX Professional Makeup Tečni metalik mat ruž za usne 31-New Era"
"8606015842271";"Spin deterdžent za pranje posuđa Lemon&Parsley"
"8051403040300";"Innamore Day 40, Nero 4 čarape"
"8008843001347";"Aloe Vera gel + vitamin E + Tea Tree oil 200ml"
"8009518112733";"Deborah 24 Ore 3 tečni puder"
"9000101225518";"Fa muški poklon set Sport (Active Sport energizing shower gel 250ml + dezodorans 150ml)"
"3607349684495";"Adidas Control ženski dezodorans u spreju 150ml"
"3600531411121";"Maybelline New York Superstay Matte INK Tečni ruž 25 Heroine"
"8606017872160";"LLUMS One-to-One senka 02 Midnight (Navy)"
"4251232280357";"Catrice te blush flush fluid Glow C01"
"8001280013973";"Felce kupka plava"
"4017645036864";"Logona šampon lemon balm "
"8711600337954";"Dove Deeply Nourishing gel za tuširanje"
"8058664051861";"Chicco Giotto Physio Soft laža od silikona plava 0-6m"
"8606014795530";"Home&Family abrazivni sunđer za pranje posuđa 10 komada"
"3433422403673";"La Roche Posay mleko za telo"
"9000101050899";"Gliss Ultimate Oil Elixir maska za kosu 300ml"
"4004711752407";"Naomi Campbell ženski parfem 30ml"
"3600542109734";"Garnier Skin Naturals Dvofazna micelarna voda za čišćenje lica 100 ml"
"30103306";"Maybelline Colorama 70 lak za nokte"
"5045252667361";"Burberry Classic Women EDT ženski parfem 30ml"
"5011408064988";"L'Oreal Paris Excellence 4.54 boja za kosu"
"5201314201090";"C - Thru Beauty gel za tuširanje"
"3661434000522";"Uriage termalna voda 300ml"
"3386460101844";"Karl Lagerfeld bois de yuzu Man muški parfem EDT 50ml"
"8710908317361";"Dove Cool Fresh muški gel za tuširanje, 250ml"
"9005800283708";"NIVEA Care & Hold gel za regeneraciju 150ml"
"3770006053139";"Charlotte Family bio dezodorans bez gasa zeleni čaj 75ml"
"5011321260580";"Old Spice Lagoon gel za tuširanje"
"5201314955207";"C - Thru Lovely Garden dezodorans"
"96145791";"Max Factor Creme Bronzer Light gold 05"
"3052503825205";"Bourjois Contour Clubbing 52 olovka za oči"
"5997321759340";"Airwick fm zimski bobičasti plodovi komplet 250ml"
"3700306910498";"Couleur Caramel senka za oči 049 Pearly Anthracite Grey"
"4084500981614";"Fairy Chamomile deterdžent za posuđe 450ml"
"309976348407";"Revlon Just Bitten Balm stain Ruž u olovci NO:040"
"8606014798869";"Velnea Malina balzam za usne 10 ml"
"5037156227673";"John Frieda Brilliant Brunette balzam za vidljivo potamnjivanje kose 250ml"
"86034432";"Aura Amazingly Resistant lak 417"
"3014260095062";"Oral B 3D White Pro flex četkica za zube meka 1kom"
"4059729024138";"Essence Cyp born awesome paleta za oči i lice"
"800897178994";"NYX Professional Makeup Set ruževa i olovki za usne Sugar Trip Lippie Vault"
"8606011748027";"Celasa Lipohol kapsule A30"
"8009518328073";"Deborah Keith Haring 24Ore wp ajlajner"
"8606107462073";"Kolagen Colnatur – sa ukusom šumskog voća"
"309976918082";"Revlon Photoready Airbrush tečni puder 08"
"8594059734907";"Simply You HemoStop Probio 30 tableta + gel 75ml"
"8606011570451";"Meilab pena za tuširanje sa 15% bademovog ulje 200ml"
"5901761915235";"Eveline Mini Max Lak za nokte 065 5ml"
"4005808801046";"NIVEA univerzalna krema za ruke 150ml"
"8600931008551";"Multiactiv Care&Protect mini losion za sunčanje SPF35 50ml"
"3052503825007";"Bourjois Contour Clubbing 50 olovka za oči"
"800897848293";"NYX Professional Makeup Ruž za usne Lip Lingerie 02-Embellishment"
"8606106893014";"Sapun od kozijeg mleka sa lavandom"
"8606104556706";"Appetite i weight control, Glukomanan formula 90 kapsula"
"8606108119112";"Zdravo bilje spirulina tablete 75G A200 Promo"
"8718375520888";"Keune Tinta Color boja za kosu No.7.73"
"3600542146586";"Garnier Mineral Neo Dry Mist Panthenol 150ml"
"3607343088060";"Adidas dezodorans sprej ap sport energy, 150ml"
"5012008469609";"Pro voke touch of silver intensive regenerator za kosu 200ml"
"4018852100317";"Bebivita kruška 190gr"
"9000101056297";"Schauma regenerator za kosu Succulent raspberry & sunflower oil 200ml"
"8691190856229";"Golden Rose Longstay Liquid Matte ruž za usne 22"
"5012874125456";"Rimmel korektor u stiku 103"
"8003510021215";"Breeze freshezza talcata dezodoranas u spreju 150ml"
"8606101005092";"Vendoksin gel 100ml"
"8606017870289";"VZK Pantenol rastvor 5% 125 ml"
"3401353698923";"Bioderma Photoderm sprej za sunčanje SPF 30 "
"8606019170288";"Yesss! Ukrasna kesa rođendanska cvetići"
"8606017870326";"VZK Intenzivni tretman protiv strija 150 ml"
"5310073006447";"Sensilis® Mam Care Lanolin "
"9000101011197";"Taft Ultra Control lak za kosu 250ml"
"4008666700032";"Plantur 39 fito kofeinski šampon 250ml"
"8606108119143";"Zdravo bilje Garcinia Camboga Maxi fit caps A90"
"6001159114109";"Bio-Oil ulje protiv strija 60ml"
"4008576312387";"Titania nožić / gurač za zanoktice"
"9000100340458";"Taft Power vosak za kosu"
"6905887745584";"Mr Black Peel-off  maska na bazi aktivnog uglja 60g"
"4002448116554";"Scholl Velvet Smooth Saida električna turpija za pete refil 2kom"
"3760143830519";"Marilou piling za lice 75ml"
"9000100999922";"Schauma Sea Buckthorn šampon za kosu"
"3800708382265";"Elea Profesional farba za kosu No 07.1 138ml"
"8008843008711";"Multicomplex Senior vitamini + minerali + koenzim Q10"
"3600542072113";"Garnier Color Sensation 5.51"
"4005800207471";"Eucerin Hyaluron Filler Noćni intenzivni serum"
"3600542010733";"Garnier Skin Naturals Micelarni gel 200 ml"
"4008233103990";"Kneipp penušava kupka veseli um 400ml"
"3600523499335";"L'Oreal Paris True Match  Kompaktni puder  3.D Golden Beige"
"4744183010635";"Natura Siberica šampon za ofarbanu i oštećenu kosu, 400ml"
"8606013479677";"Le petit marseillais poklon set"
"3700244200828";"Floral Aise probiotik kaps A20"
"3830029296071";"Aquafresh Complete Care Whitening pasta za zube 100ml"
"4251232262957";"Essence the gel lak za nokte 106"
"8051403104613";"Lilly čarape 20 Den Light sand 3"
"3600523386338";"L'Oreal Paris Colorista Wash Out 4 Lilach"
"9005800309743";"NIVEA poklon set Care gold bag "
"9000100806725";"Fa Sport dezodorans u stiku"
"8594059733436";"Simply You HerbalMed pastile ehinacea i pasji trn"
"9005800285337";"Eucerin set (Hyaluron Filler dnevna krema + gratis antirid)"
"800897079345";"NYX Professional Makeup Olovka za oči Faux Blacks Eyeliner 07-Obsidian"
"5201314024491";"STR8 On The Edge muška toaletna voda 50 ml"
"7610108046669";"Elmex Kids pasta za zube"
"3600523541935";"L'Oreal Paris Smooth Sugars Scrub Clearing Piling za lice 50ml"
"5201314078913";"BU Absolute Me natural sprej 75 ml"
"8606017970255";"Still Biotech četka za kosu TTČ048"
"3838824171401";"Palette Pnc boja za kosu 600 "
"86034067";"Aura Shine Excess ruž za usne 768"
"8009518316469";"Deborah Trio senke za oči 03"
"8607000091834";"Trisa Flexible head 3 soft četkiva za zube 1kom + gratis četkica"
"4018852001508";"Bebivita krompir, šargarepa i govedina 190gr"
"8051403105962";"Lilly čarape 15 Den Suede 4"
"86030779";"Aura višenamenska četka "
"8606100237807";"STR8 Original poklon set"
"8606017872399";"LLUMS Hidrantni ruž za usne - 02 Tea Rose"
"8710447385128";"Dove poklon set Men Charcoal&Clay"
"5201314079330";"BU Absolute Me toaletna voda 50ml"
"3830001298451";"Afrodita Regenerator za kosu Med & Badem proteini 500 ml"
"8691190069605";"GR Dual Ended Eyeshadow Brush "
"8691190704223";"GR Color Sensation Lipgloss NO: 122"
"5055193535780";"Sunkissed losion za samopotamnjivanje medium/dark 200ml"
"800897016869";"NYX Professional Makeup Tečna senka za oči 08-New Romance"
"8003693401040";"Ge tečni sapun Antibatterico dispenzer "
"800897064129";"NYX Professional Makeup Olovka za usne Suede Matte 02-Lifes A Beach"
"8606017876274";"Velnea Pure Plus blaznice 80kom"
"9000100998895";"Gliss Ultimate Resist maska za kosu"
"8606003060649";"Kirka Etarsko ulje Čajno drvo"
"800897825669";"NYX Professional Makeup Senka za oči Hot Singles 02-Pink Cloud"
"3600523371051";"L'Oreal Paris Botanicals Geranium Šampon za obojenu kosu 400ml"
"4008576375252";"Titania balzam za pete 25% uree"
"3504105028220";"Mustela obogaćen losion za telo sa Cold kremom 200ml"
"8606017878230";"LLUMS četkica za hajlajter F05 1kom"
"4251232218626";"Catrice 24h Made to stay tečni puder 010"
"8009518135725";"Deborah BB Cream 03 puder"
"3574660117028";"Johnsons Baby Camomile ulje"
"4008576002714";"Titania četka za kosu"
"9005800276069";"Nivea Active Clean set za muškarce (gel za tuširanje + šampon za kosu + univerzalna krema)"
"309976790015";"Revlon ColorStay Olovka za oči NO:201"
"4075700044544";"Kräuterhof gel od đavolje kandže 250ml"
"8717644627624";"Dove Clean Comfort gel za tuširanje"
"4084500161443";"Camay Vintage sapun"
"800897016838";"NYX Professional Makeup Tečna senka za oči 05-Night Glow"
"3052503753430";"Bourjois rumenilo 34"
"5011321331594";"Head & Shoulders Menthol šampon za kosu 400 ml"
"3850105154699";"Faks Natural Sensitive tečni deterdžent za veš"
"3607342817098";"Calvin Klein Reveal Edp ženski parfem, 30ml"
"8606019175603";"LLUMS Metallic glam olovka za oči Royal blue"
"8411114001456";"Woman'Secret Sweet Temptation Cherry EDT 40ml"
"800897143770";"NYX Professional Makeup Mat ruž za usne 11-Tea Rose"
"3052503301532";"Bourjois lak za nokte 15"
"800897825874";"NYX Professional Makeup Senka za oči Hot Singles 23-Showgirl"
"5011321352766";"Wash & Go Kopriva šampon za kosu"
"4251232221886";"Essence My Must Haves senka za oči 18"
"3600522337003";"L'Oreal Paris Infaillible X3 ruž 121"
"40133195";"Dove Goodness ulje za telo"
"4023103146884";"Vileda glitzi power sunđer abraziv 1 komad"
"8606017876885";"Yesss! Četka za feniranje kose mala C5712R"
"3838824307268";"Palette Icc  boja za kosu LW3 Dazzling Mocha "
"8009518115871";"Deborah 24 Ore 3 korektor"
"8300694640400";"Pompea Twin 20 Claro 1/2 S čarape"
"3600522840114";"L'Oreal Paris True Match Tečni puder 1,5. N "
"8008843006960";"ESI Aloe fresh osveživač daha"
"4008576362382";"Titania jastučići za obuću"
"9000100194419";"Fa Sport gel za tuširanje"
"8691190142087";"GR Dream Eyes Eyeliner  NO: 408"
"88551167847";"Bionsen Mineral protect dezodorans Roll on 50ml"
"4017645016668";"Logona krema protiv crvenila 30ml"
"80320104";"Deo stik Invisible Neutro Roberts"
"8606014796131";"Lilly Limeta i grejpfrut prirodni ekstrakti tečni sapun 1000ml"
"3859889915823";"Biobaza Beauty blagi gel za umivanje osetljive kože lica 200ml"
"8003350506071";"Logex 20 kesa za smeće"
"4045612000747";"CD duš losion Sanddorn"
"4251232284362";"Catrice Spectra light effect lak za nokte 01"
"8008970040738";"Tesori Di Oriente vizantija kupka 500ml"
"9000100904032";"Somat Antigrease gel za pranje posuđa"
"4003790006890";"Vileda rukavice sensitive veličina l"
"800897143732";"NYX Professional Makeup Mat ruž za usne 07-Alabama"
"4607174431591";"Naturia Siberica krema za ruke sa učinkom liftinga, 75ml"
"4251232217575";"Catrice 18h Colour & contour olovka za oči 070"
"9000100889087";"Bref Blue Aktiv WC osveživač"
"3871267003274";"Ovnak Aplikator za senke GN-G19A 17"
"309975410105";"Revlon Colorstay tečni puder za kombinovanu i masnu kožu 320"
"5054563040213";"Parodontax Complete Protection Extra fresh pasta za zube 75ml"
"679602469623";"Police Passion ženski poklon set "
"8607000126024";"Immunitea Forte Caps A20"
"3838945502566";"Frutek breskva, grožđe i riža kašica 190gr"
"8606107840543";"Prefer Ocean of love parfemski losion za telo 160ml"
"4005800064913";"Eucerin sprej za sunčanje SPF 20"
"9000100921862";"Palette Perfect Care Color boja za kosu 566   "
"8056777044541";"Pompea Ursula Blu Unica čarape"
"4607174431492";"Natura Siberica Little balzam za lakše češljanje kose za decu, 250ml"
"LP22";"VZK Konjski balsam hladni"
"8600334396132";"Evy Baby pelene Box 5 Junior 12-25kg 72kom Novo"
"3838952016247";"Paloma toalet papir"
"800897828837";"NYX Professional Makeup Prajmer za lice Angel veil 30ml"
"3600522862505";"L'Oreal True Match puder 5C"
"4015600620004";"Blendamed 3d White Fresh pasta za zube"
"6944990002221";"Innamore Body Slim 40 Daino 3 čarape"
"3600522632436";"L'Oreal Paris Age Expert 55+ Noćna krema (50 ml)"
"8691190466138";"GR Velvet Matte Lipstick NO: 13"
"9000100690874";"Fa Sensual & Oil gel za tuširanje"
"8606107403069";"Lavanda vodica 30ml"
"9005800265032";"Nivea losion za uklanjanje šminke "
"3614222348351";"Playboy Queen toaletna voda 40ml"
"800897809034";"NYX Professional Makeup Iluminator 04-Ritualistic"
"4005808850112";"Labello Natural mleko i med 4.8g"
"800897829926";"NYX Professional Makeup Tečni mat ruž za usne 14-Zurich"
"3600523404353";"L'Oreal Paris Color Rich Matte Lip Palette 01 Bold Ruž za usne"
"8691190560607";"GR Rich Color Nail Lacquer NO: 60"
"4251232280326";"Catrice te blush flush kremasto rumenilo C01"
"5011321104099";"Max Factor Colour Adapt Warm Almond 45"
"3760049890297";"Biogripin"
"5011417548134";"Finish Regular Limun prašak za mašinsko pranje posuđa 1 kg"
"8710522377543";"Dove Summer gift box Paris "
"8606106817652";"Vulkan kutija velika - mače i klupko"
"4000821370104";"Nip četka za flašice Swirly"
"8009518316506";"Deborah Trio senke za oči 05"
"3401399372926";"Bioderma Atoderm blagi gel za tuširanje 1L"
"86038775";"Aura Explicit 11.1 farba za kosu + gratis olovka"
"4005808443185";"NIVEA 3u1 sredstvo za dubinsko čišćenje lica 150ml"
"3600542114165";"Garnier Botanic Therapy Honey and Propolis Maska za kosu 300ml"
"8606017971573";"Still Bio malina i crno grožđe maska za kosu 500ml"
"8606017878711";"Velnea kokos šampon za kosu 500ml"
"22249968";"Mamma&baby pelene junior 44kom + gratis mamma&baby vlažne maramice "
"4008455004174";"Dr.Beckmann Super belo"
"800897143381";"NYX Professional Makeup Ajlajner Retractable 14-Deep Blue"
"3614224429355";"Rimmel Stay matte 800 tečni ruž za usne"
"334307";"ESI Royal Jelly - matični mleč kesice - 1 komad"
"3600522203582";"L'Oreal Quad Nu E7 senka za oči"
"8051403117224";"Lilly čarape 70 Den Navy 3"
"3264680012167";"Nuxe čarobni poklon set "
"8691190445072";"GR Eyebrow Powder NO: 107"
"3600541136007";"Garnier Color Sensational 4.15 farba za kosu"
"3600541299047";"Garnier Olia 9.0 farba za kosu"
"4005900365705";"Labellino osvežavajuća Menta balsam za usne 7g"
"8710103787211";"Avent varalica klasik animal pingvin i pače 0-6m 2kom"
"8002410002232";"Deo sprej Powder Neutro Roberts"
"3858881243262";"Makulin Plus "
"4260379931428";"Monoi i The Brazilian ulje za kosu"
"309976012070";"Revlon ColorStay Gel lak za nokte 460"
"8606017870012";"Velnea Hidrantna noćna krema za sve tipove kože, 50ml"
"3614224102951";"Bourjois Rouge de Velvet ruž za usne 06"
"4251232257106";"Catrice brown collection lak za nokte 01"
"3850104250972";"Lino Crunch 225g"
"3607342924031";"Rimmel Wonderful Extra maskara za oči"
"8606017875475";"Yesss! Šnala za kosu sa štrafticama 2kom"
"4250587701173";"Essence 2in1 ajlajner"
"681619805011";"The Balm Mr.Write now Brian olovka za oči"
"4251232257113";"Catrice Brown Collection lak za nokte 02"
"8714789608303";"Colgate četkica 360° Surround Medium"
"86036436";"Aura Amazingly Resistant lak 439"
"8606018100293";"By Magic Timless EDP muški parfem 20ml"
"7630019900171";"Gum Interdental Trav-ler 0.9mm"
"3850104230073";"Frutolino 200 g kut"
