barkod;naziv
"8691190643409";"Golden Rose Ice color nail lacquer No.140 lak za nokte 6ml"
"681619100284";"The Balm Girls Mia Billsbepaid ruž za usne"
"8009518236026";"Deborah 09 Milano ruž za usne"
"3871267028024";"Ovnak Češalj/Četkica za obrve"
"8606019173616";"21 Lak za nokte 15  11ml"
"3600542161121";"Garnier Color Sensation Opal Blonds 8.12 Boja za kosu"
"3859889915755";"Biobaza sapun hidratation 100g"
"8600618015018";"Oligovit tablete "
"4008600092155";"Nuk plastična flašica 300 ml plava"
"3838824086675";"Schauma Men šampon za kosu"
"800897064143";"NYX Professional Makeup Olovka za usne Suede Matte 04-Soft-Spoken"
"3401347869546";"Cicabio Creme"
"7612412423488";"Curaprox Superduo četkica za zube i interdentalna četkica"
"8606017871125";"Dent-a-dent Ice Brush Super Sensative četkica za zube 1 komad"
"41042632";"Swiss O–Par tretman za kosu sa medom 25 ml"
"8606106817751";"Vulkan kutija velika - pokloni"
"9000101215878";"Nature Box Apricot šampon za kosu 385ml"
"3282770100136";"Avene Couvrance komapktni puder Oil free 1 10g"
"9000101214406";"Nature Box Coconut gel za tuširanje 385ml"
"3838980522116";"Subrina šampon protiv peruti"
"9005800297569";"Eucerin Box (Hyaluron Filler dnevna krema za normalnu i kombinovanu kožu 50ml + noćna krema)"
"8606015870519";"Žuti noćurak krema"
"800897017637";"NYX Professional Makeup Paleta senki za oči Ultimate Shadow 02-Cool Neutrals"
"86034692";"Aura mat ruž 617"
"4005808817306";"Nivea Energy gel za brijanje "
"800897825683";"NYX Professional Makeup Senka za oči Hot Singles 04-Pink Lady"
"3760049893120";"Biofar Tri-Activ"
"9000101074017";"Color Expert posvetljivač L8 farba za kosu"
"3337871325268";"Vichy Ideal 25 krem puder"
"4210201227243";"Oral B poklon set "
"8718114670966";"Dove Gel za tuširanje Aqua Impact"
"8606011742292";"Betavitevit folna 400 sa vitaminom B12"
"800897085360";"NYX Professional Makeup Olovka za obrve 04-Caramel"
"4017645011823";"Logona krem šampon bambus   "
"800897840303";"NYX Professional Makeup Tečni kremasti ruž za usne Suede 10-Amethyst"
"4210201784982";"Oral - B Power Brush D20 2999"
"800897826376";"NYX Professional Makeup Senka za oči Hot Singles 73-Sex Kitten"
"5903407225500";"Canpol Baby varalica"
"8714789632506";"Colgate Sensitive Pro Relief Whitening  pasta 75ml"
"8712561773843";"Rexona Turbo dezodorans"
"4059729010995";"Catrice Ultimatte matt ruž za usne 080"
"8901138506384";"Himalaya Nourishing Skin Cream krema za ruke 150 ml"
"3600541343702";"Garnier Color Naturals 1.17 farba za kosu"
"3830001295528";"Afrodita Oliva hidratantan dnevna krema za lice 50 ml"
"3600541678644";"Garnier Color Naturals 6.23 farba za kosu"
"7350075690082";"Humble četkica od bambusa za decu supersoft 1kom"
"8058664042913";"Chicco Zanza prenosivi uređaj protiv komaraca"
"8718375527436";"Ultra mild daily use regenerator"
"8606013479592";"Le Petit Marseillais poklon set (mleko za telo sa shea puterom 250ml + gel za tuširanje kokos 250ml)"
"3607347410928";"Adidas dezodorans roll-on Ice dive, 50ml"
"9000101080049";"Live Color Blue Twist sprej za kosu 120ml"
"3858881248021";"Multivita kalcijum plus šumeće tablete A20"
"42209522";"Max Factor Colour Xpert Wp Liner 01 Deep Black"
"3600530905027";"Maybelline Colorama 320 olovka za oči"
"800897831516";"NYX Professional Makeup Gel ajlajner Tres Jolie 02-Brown"
"3600542134835";"Garnier Fructis Aloe Regenerator za kosu 200ml"
"3337875560931";"Vichy Lift Fresh shot 10ml"
"800897822194";"NYX Professional Makeup Maskara za oči Super Luscious 05-Full Figured"
"8606017871163";"Dent-a-dent voskirani konac za zube sa ukusom mente 75m"
"5000204963281";"Duck Wc tečnost Petals 750ml"
"9005800279091";"NIVEA Q10 set torba za negu lica (dnevna krema + mleko za lice + maska za lice)"
"5201314932024";"Fino kese za smeće 120l "
"800897077938";"NYX Professional Makeup Ruž za usne Lip Lingerie 19-Dusk To Dawn"
"4084500149755";"Head & Shoulders Thick & Strong  šampon za pranje kose 200 ml"
"9062300100959";"Hipp povrće sa pirinčem i piletinom"
"3600542114202";"Garnier Botanic Therapy Honey and Propolis Šampon 250ml"
"4084500197534";"Head & Shoulders Thick & Strong 2u1 šampon"
"4059729010988";"Catrice Ultimate Matt ruž za usne 070"
"800897141226";"NYX Professional Makeup Olovka za oči Slide On 07-Jet Black"
"8606107367095";"Aura olovka za usne 54"
"8606102544293";"Vitalis digesto kapsule 30 komada"
"8606017970934";"Still Popart boja za kosu 10"
"679602692427";"Police To be Miss beat Edp ženski parfem 40ml"
"800897104788";"NYX Professional Makeup Sjaj za usne Duo Chromatic 01-Booming"
"3614224429300";"Rimmel Stay matte 500 tečni ruž za usne"
"5900017062266";"NIVEA MEN DEEP gel za tuširanje 500ml"
"4005800005459";"Eucerin Transparentni sprej za zaštitu osetljive kože od sunca SPF 50"
"8606108022719";"Jana Dačović Bloom Edp 50ml"
"8008970036847";"Denim Black poklon set"
"8992304056994";"Maybelline New York Fit Me 130 Buff Beige Kompaktni puder"
"8009518324655";"​​​​​​​Deborah Super gloss sjaj za usne 07"
"4059729030177";"Catrice Iconails gel lak za nokte 58"
"4005808699773";"NIVEA Essentials noćna krema protiv bora 50ml"
"8009518245479";"Deborah 06 paleta senki za oči"
"4001638086875";"Weleda Dnevno-noćni fluid za lice od divlje ruže za mešovitu kožu"
"8600102944381";"Bioon Deep Repair balzam za kožu 30ml"
"4251232249996";"Essence Soft Contouring olovka za usne 11"
"3600531464295";"Maybelline New York Color Sensational Powder Matte Ruž za usne 35"
"8691190122416";"Golden Rose Falce Lashes maskara"
"8606017878704";"Velnea jabuka regenerator za kosu 500ml"
"5000204642025";"Raid sprej za sve vrste insekata 300ml"
"8690604280698";"Flormar Perly lak za nokte 201"
"5900273205063";"Lady Speed Stick Gel 24/7 Fresh Fusion "
"8691190466015";"GR Velvet Matte Lipstick NO: 01"
"3052503810737";"Bourjoise olovka za obrve 07"
"4251232261967";"Essence dugotrajna olovka za oči 28"
"3414200800143";"Davidoff Cool Water wave Woman edt 100ml"
"7317400015842";"Tepe Easy Pick Interdentali XS/S Tirkiz 36 komada"
"8601900406057";"Juvitana kašica od šljive 128g"
"8300694510871";"Pompea Classico 20 Playa 1/2 čarape"
"3600522689874";"L'Oreal Casting Cream Gloss boja za kosu 6.354"
"8717185381894";"Keune Tinta Color boja za kosu No.1001"
"3838824289434";"Palette Pnc boja za kosu 220"
"3838945030670";"Frutek spanać i ćuretina kašica 190 gr"
"3830029294800";"Aquafresh Milk Teeth dečija pasta za zube 50ml"
"9000101080810";"Gliss Scahet Ultimate Repair maska za kosu 20ml"
"8606106129939";"Aura Explicit farba za kosu 12.89"
"4603014001061";"Splat White Plus pasta - za izbeljivanje zuba i kompletnu negu"
"9000100753340";"Bref Aktiv Pine WC osveživač"
"4251232241938";"Catrice Iconails gel lak za nokte 10"
"8691190567088";"Golden Rose Smart ruž u olovci 08"
"3337871323790";"Vichy Dercos regenerator za suvu kosu 150 ml"
"3614222918981";"Rimmel maskara Volume Shake Extreme black"
"5943048003297";"Bioten maramice za čišćenje lica"
"3600530589555";"Maybelline Affinitone korektor 03"
"4005808518081";"NIVEA MEN Silver Protect gel za tuširanje za muškarce 250ml"
"800897138486";"NYX Professional Makeup Tečni mat metalik ruž za usne Soft Matte Metallic 08-Seoul"
"8606019174330";"Velnea med i mleko gel za tuširanje 300ml"
"8606019892494";"Yesss! četka za kosu mint 9552-xp 1kom"
"5943048004621";"Bioten intentivni anticelulit serum"
"8300694583608";"Pompea Vani 15 Nero XL hulahopke"
"8606011746139";"Protect Melatonin"
"5201314080657";"Orzene Detox maska za sve tipove kose 250ml"
"9000101212662";"Pure Color 8.4 Mineralna plava farba za kosu "
"5012583205005";"Live Lightener Twist boja za kosu 104 "
"309976348155";"Revlon Just Bitten Balm stain Ruž u olovci NO:015"
"8606017871453";"LLUMS Lak za nokte - GE White Snow"
"8717163340561";"Rexona Aloe Vera dezodorans"
"8608808111434";"Chymoral tablete 30 komada"
"8606017878681";"Velnea body brijači sa pet oštrica dopuna 4kom"
"8691190070847";"Golden Rose hajlajter u stiku 02"
"309976012261";"Revlon ColorStay Gel lak za nokte 620"
"3052503234229";"Bourjois ruž za usne 42"
"9000101057775";"Syoss Salon Plex tretman za kosu 300ml"
"3600522996828";"L'Oreal Paris Infaillible Gloss sjaj 505"
"3401399277092";"Bioderma Sebium gel za lice"
"3700306918234";"Couleur Caramel Bio mineral loose puder u prahu 03 Apricot beige"
"8606014791198";"Mamma&Baby sapun"
"4251232214062";"Essence The Little Xmass Factory lak 03"
"3661434005039";"Uriage Eau Thermale Legere krema SPF 20, 40ml"
"4016369634097";"Dr Theiss gavez krema sa termo efektom 100ml"
"8606017876878";"Yesss! Četka za feniranje kose srednja C5713R"
"800897140250";"NYX Professional Makeup Maskara Worth The Hype "
"8606017872108";"LLUMS senka 11 True Steel (Grey)"
"681619800603";"The Balm rumenilo Argyle"
"86036849";"Aura Shine Excess 776 ruž za usne"
"334347";"Monoderma A15 Vitamin A retinol 0.15% - kapsule 28x0.5ml - 1 kapsula"
"3830001296716";"Afrodita Chamomilla uljni aceton 125 ml"
"8606019173326";"Solevita Omega 3+ Vitamin E kapsule 90/1"
"3800233121551";"Maybelline New York Poklon set Nudes Palette + Lash Sensational Luscious Maskara "
"8600102607361";"Aura Explicit farba za kosu 5.20"
"8001090694690";"Pampers Pants Gp 5 Junior pelene za bebe 52kom"
"4005808193196";"NIVEA Diamond Gloss Care Balsam 200ml"
"3607346621875";"Super Playboy muški parfimisani dezodorans 75ml"
"4056800895298";"Wellaton 66/46 maxi single"
"3600522903390";"LÓreal Paris Excellence 4.02 Boja za kosu"
"4251232256178";"Catrice paleta za obrve matt & glow 020"
"8009518171631";"Deborah 18 sjaj za usne"
"800897836870";"NYX Professional Makeup Olovka za obrve Micro Brow 05-Ash Brown"
"7391715022177";"Depend turpija za nokte"
"4001499115998";"Frosch Kimder tečni sapun - dopuna, 500ml"
"4059729039392";"Essence Glitter on glitter off peel off lak za nokte 04"
"8606017876090";"Velnea White tečni sapun 1000ml"
"86038072";"Aura pigment u prahu za popunjavanje obrva Browart Blonde"
"3600521105825";"L'Oreal True Match Mineral N6 Honey puder"
"4005800055454";"Eucerin pH5 Losion za intimnu higijenu 250ml"
"8009518179934";"Deborah Atomic Red Mat 19 ruž za usne "
"8594002683023";"Calgon sredstvo za uklanjanje kamenca"
"8606108972250";"Signal Long Active White fresh pasta za zube 75ml + 1 gratis"
"8691190856069";"Golden Rose Longstay Liquid Matte ruž za usne 06"
"8011003996193";"Versace Pour Homme set (EDT+ šampon za kosu i telo)"
"4059729037374";"Essence Melted chrome senka za oči 01"
"8691190860363";"Golden Rose Ice Chic lak za nokte 36"
"4005800634857";"Eucerin Hyaluron-Filler Dnevna krema za suvu kožu SPF15"
"4017645040762";"Logona vitaminska krema šargarepa "
"8717644242285";"Dove Fall Control šampon"
"3522930001317";"Caudalie Vinexpert "
"4744183010321";"Natura Siberica Oblepikha šampon za masnu kosu 400ml"
"9062300133131";"Hipp BIO kašica Dečji keks sa jabukom 190gr"
"4251232258660";"Essence Metal Shock lip paint ruž za usne 06"
"8606106817850";"Vulkan kutija mala - cveće"
"3871267001065";"Ovnak Turpija za nokte  SN/45C"
"4075700216552";"Iris Krauterhof Green tea kofeinski šampon za kosu 250ml"
"3830001299335";"Afrodita beli luk šampon za kosu 30 ml"
"8606106356441";"Baby King Pirinčane cerealije Organik 200gr"
"3614221293195";"Playboy xmas set wild m ( bs150ml + sg250ml )"
"3052503735214";"Bourjois Healthy Mix puder 52"
"4059729021915";"Essence Colour boost mad about matte tečni ruž za usne 05"
"8606017871675";"LLUMS Lak za nokte - GE Supreme"
"3661434005015";"Uraige EAU Thermale krema oko očiju 15ml"
"5000386008466";"Revlon Charlie Red EDT ženski parfem 100ml"
"4084500489806";"Lenor Pure Care omekšivač za veš"
"5907609399540";"Eveline Argan&Vanilla In Shower"
"4008576502115";"Titania makazice Solingen 1050/21H"
"8717185385526";"Keune Root volumizer design pena za kosu"
"5060025824499";"OMG Loved Up poklon set"
"3600523465262";"L'Oreal Paris Color Riche Shine ruž 112 Only in Paris"
"3264680010798";"Nuxe Reve De Miel Creme mains et ongles krema za ruke i nokte 50mlx2 promo pakovanje"
"96048054";"Dove Pure roll on"
"6430051420054";"Sophie La Girafe bebi bebi ulje za telo 200ml"
"3600542176750";"Garnier Fructis Wonder Butter Maska 300 ml"
"8001090504845";"Lenor Deep Sea Minerals omekšivač za veš 1.35l"
"8022297013664";"Alfaparf  farba za kosu am 12.00 platinasto plavo, 150gr"
"3600523438112";"LÓreal Paris Mega Volume Miss Baby Roll Black Maskara"
"4001499915215";"Frosch Baby omekšivač za veš "
"3401398303648";"Bioderma Cicabio arnica krema 40ml"
"8300694640226";"Pompea Twin 20 Tabacco 1/2 S čarape"
"8606019173715";"21 Lak za nokte 25 11ml"
"3600541299009";"Garnier Olia 7.0 farba za kosu"
"8690604310647";"Flormar Full color nail enamel lak za nokte"
"800897813857";"NYX Professional Makeup Tečni puder Stay Matte But Not Flat 11-Sienna"
"7702018076161";"Gillette Blue 3 Speed brijači 6 komada"
"8600618015162";"Sant·E·Gal® tablete za žvakanje "
"681619500541";"The Balm Nude Tude Naughty paleta senka za oči"
"4251232283013";"Catrice Art Couleurs senka za oči 170"
"4250947516164";"Essence Nude 04 senka za oči"
"86037877";"Aura Revolution 19 Break free olovka za usne"
"9000100943840";"Vademecum pasta za zube NonStop White 75ml "
"8691190960339";"GR Wow Nail Color  NO: 33"
"8606013479370";"Wash&Go francuska lavanda šampon za kosu 400ml +gratis lavanda balzam za kosu 200ml"
"3574660471823";"Johnsons krema za bebe"
"3600523556014";"L'Oreal Paris La Petite Palette Paleta senki za oči Maximalist"
"8606003350078";"Eko K+ tablete 24 komada"
"3600550304459";"Mixa krema za suvu kožu lica, 50ml"
"4005808861446";"NIVEA BABY Pure & Sensitive vlažne maramice 63kom"
"8690604141135";"Flormar Enamel lak za nokte 425"
"8059147053280";"Chicco bm losion za telo 200ml"
"4059729028518";"Catrice Insta to go blur stick rumenilo 010"
"4059729004963";"Essence Volume hero power black maskara"
"86030328";"Aura veštačke trepavice 05 "
"5201314697978";"STR8 Cool & Dry Escape dezodorans u spreju 150 ml"
"4250587772173";"Essence WP ajlajner 01"
"3600522337171";"L'Oreal Paris Infaillible X3 ruž 505"
"0618059109737";"PhytoColor farba za kosu 9D"
"3838980502156";"Ehoton 97 kolor šampon"
"8003670754176";"Chicco gel protiv komaraca"
"3607349792367";"Miss Sporty puder"
"30107427";"Maybelline Colorama 283 lak za nokte"
"3838945502504";"Frutek kajsija i kruška kašica 120gr"
"8436097093724";"Byphasse micelarna voda 500ml + gratis 100ml"
"3337872419904";"La Roche Posay Anthelios dečiji losion SPF50+ 50ml"
"8606017971306";"Still Fruity Color 6.10 pepeljasto tamno plava farba za kosu"
"3838824345956";"Fa Men Sport poklon set "
"4059729047656";"​​​​​​​Essence te fall back to nature kist za hajlajter & rumenilo 01"
"86039666";"Aura Mat kremasti ruž za usne Matte 632"
"42333104";"NIVEA Care & Hold mini sprej za regeneraciju kose 75ml"
"8606018100156";"By Magic Crystall EDP ženski parfem 20ml"
"9000101016376";"K2R intenzivno belo i odstranjivač fleka 5 komada"
"309978161189";"Revlon Ultra HD Mat Revlon Ultra HD Mat ruž za usne Kisses 655"
"8607000024306";"Sapun od kozijeg mleka"
"800897141172";"NYX Professional Makeup Olovka za oči Slide On 02-Black Sparkle"
"800897839420";"NYX Professional Makeup Olovka za usne Slide On 03-Pink Canteloupe"
"3600521150207";"L'Oreal Paris Elseve Volume Collagen, šampon za kosu 250ml"
"5901761911770";"Eveline 8 in 1 Antiperspirant krema za stopala 100ml"
"8005610371016";"Bruno Banani Man's Best Edt 30ml"
"3600530559497";"Maybelline Color Sensational ruž 245"
"4015400542476";"Discreet Irresistible dnevni ulošci"
"3600542051057";"Garnier Botanical Tonik za suvu i osetljivu kožu 200ml"
"5903407044125";"Canpol baby činija 4/412 1kom"
"30140820";"Essie Lak za nokte 427  Maki Me Happy"
"8711600323520";"Impulse Very Pink dezodorans"
"4000196012159";"Kamill Intensive krema za ruke i nokte 150 ml"
"8710447190210";"Dove Poklon set letnji '60s (gel za tuširanje 250ml+dezodorans 150ml + losion za telo 250ml)"
"4001638098090";"Weleda slana pasta za zube 75ml"
"8600931007851";"Poklon paket Azurni"
"4005800024115";"Eucerin UreaRepair Plus Losion sa 10% uree 250ml"
"3086123508439";"Bic Miss Soleill Special edition ženski brijač 3kom+gratis 1kom"
"8606107094564";"Držač za četkice - prase"
"8690604310388";"Flormar Full color nail enamel lak za nokte fc-02"
"8009518140576";"Deborah Hi Tech 58 rumenilo"
"3600541135987";"Garnier Color Sensational 3.16 farba za kosu"
"3600010018278";"Garnier Pure Losion za masnu kožu"
"3614222000792";"Playboy Sexy ženska toaletna voda 40ml"
"5011417566428";"Airwick mirisni štapiči Želje uz božićnu jelku 30ml"
"8411114057262";"Pepe Jeans for him Edt muški parfem 50ml"
"8032523250404";"Monoderma C10 Vitamin C 10% - kapsule 28x0.5ml"
"4059729047625";"Essence Te fall back to nature I love extreme crazy volume brown maskara 01"
"3600541021068";"Garnier Mleko za telo sa Aloe Verom "
"9000101211634";"Pure Color 4.6 tamna čokolada farba za kosu"
"5201314557784";"Carroten ulje Omega Carrotene SPF20 125ml"
"3386460046497";"Balmain Ivore Edp Woman 4.5ml mini"
"8691190420581";"GR Perfect Finish Liquid Foundation  NO: 58 "
"5201314070641";"Bioten univerzalna krema 75ml"
"9005800243788";"NIVEA Creme Smooth kremasti gel za tuširanje 500ml"
"4251232217520";"Catrice 18h Colour&Contour olovka za oči 020"
"3661434003660";"Uriage micelarna termalna voda za mešovitu i masnu kožu 250ml "
"5052197046694";"Scholl Light Legs Biege 20Den L"
"86037952";"Aura korektivni stik u boji Undervover Orange 1kom"
"8711600799875";"Dove Clean Comfort gel za tuširanje"
"8606019174019";"LLUMS Night Garden ajlajner ljubičisti"
"3838824159416";"Palette Icc boja za kosu N1 Black  "
"3600542168229";"Garnier Skin Naturals maska za lice sa vitaminom C 33g"
"3830029296019";"Aquafresh Extra fresh pasta za zube 100ml"
"3831070651154";"Afrodita Hair Care Arganovo ulje 50 ml"
"9000101215762";"Nature Box Avocado šampon za kosu 385ml"
"8001090782267";"Ariel Mountin Spring tečni deterdžent za veš 20 pranja 1.1L"
"800897846244";"NYX Professional Makeup Tečni duo za konturisanje lica Sculpt&Higlight 03-Caramel/Vanilla"
"8606106893038";"Sapun od kozijeg mleka sa dodatkom biljnog uglja"
"50544165";"Max Factor Kohl Pencil Taupe 40"
"4251232255805";"Catrice Art couleurs senka za oči 060"
"8606017875482";"Yesss! Šnala za kosu srednja 3kom"
"4005800181559";"Eucerin DermoPure Piling za masnu kožu lica 100ml"
"3614224102968";"Bourjois Rouge de Velvet ruž za usne 07"
"3614224075965";"Rimmel Magnif'eyes double ended 007 senka + ajlajner"
"9000100854733";"Syoss Keratin lak za kosu"
"8022297013619";"Alfaparf  farba za kosu am 6.35  mahagoni tamno zlatno plava 150gr"
"4251232222265";"Essence dugotrajna olovka za oči 26"
"9000100672825";"Taft puder za volumen kose 10gr"
"8606019894573";"Velnea Kids lak za nokte Top Coat"
"70942302906";"Gum Interdental fine pink 1.2mm"
"3838945502559";"Frutek jabuka, kruška, banana i žitarice kašica"
"3856007904813";"Rosal Lip Balm Sweet Crush balsam za usne"
"3600541383227";"Garnier 2u1 Sredstvo za skidanje šminke"
"8606107367217";"Aura olovka za usne 56"
"800897838584";"NYX Professional Makeup Četkica za umekšavanje linija 15"
"8009518211047";"Deborah Gel Effect 19 lak za nokte"
"5310073001008";"Galafarm Sensilis ulje čajnog drveta 30ml"
"3600541466227";"Garnier Deo Protect 5 Cotton dezodorans"
"5201314079255";"C-THRU Glamurous dezodorans 150ml"
"4008576003681";"Titania grickalica Inox"
"8058664008360";"Chicco laža Physio Air od silikona, 4m+, 2 kom u kutiji, roze"
"8710447273609";"Rexona Orchid Fresh gel za tuširanje 250ml"
"4015600899943";"Ambi Pur Ocean & Wind osveživač za kola 2ml"
"42349822";"NIVEA MEN DEEP Roll on 50ml"
"309975726206";"Revlon ColorBurst Ruž - balzam u olovci MAT NO:220"
"9005800239170";"NIVEA Care & Honey kremasti gel za tuširanje 250ml"
"9000101312430";"Mer Sanit gel Orange sredstvo za čišćenje sanitarija 700ml"
"5025381000031";"Odaban sprej antiperspirant"
"5011408065022";"L'Oreal Excellence 10 farba boja za kosu"
"3600522764083";"L'Oreal True Match Genius puder 3W"
"86037983";"Aura Jelly tečni puder za svež izgled kože lica 212 Naturel"
"8606017872467";"LLUMS Lip Loving ruž za usne - 09 Flirting Mood"
"3614227180338";"Bourjois Rouge velvet the lipstik ruž za usne 023"
"5201314069744";"Carroten krema za lice Age Block SPF50 50ml"
"8714789614045";"Colgate Total Advanced Clean pasta"
"3830009223080";"Respect svetlo smeđa 05 farba za kosu"
"3574660156324";"Neutrogena Visibly Clear gel za čišćenje lica"
"800897143831";"NYX Professional Makeup Mat ruž za usne 17-Sweet Pink"
"8714789449265";"Colgate Total Adavanced Clean pasta "
"4008455004082";"Ekspert za fleke voće & povrće & sok"
"8600102607422";"Aura Explicit farba za kosu 90.01"
"86034739";"Aura mat ruž 621"
"3838988323357";"Medex Kolagen lift u prahu 120g"
"8606019173692";"21 Lak za nokte 23 11ml"
"4059729030214";"Catrice Iconails gel lak za nokte 62"
"8606102846090";"Coenzim Q10"
"8717185381726";"Keune Tinta Color boja za kosu No.8.34"
"8009518057041";"Deborah 7 Days 787 lak za nokte"
"4059729002259";"Essence draw the line instant colour olovka za usne 16"
"3600542110396";"Garnier Color Sensation Vivids Aqua Blue Boja za kosu"
"8607000139291";"Dr Colić 3u1 micelarna voda 200ml"
"86027175";"Aura sjaj Glossy 52"
"4250587754186";"Catrice dugotrajna olovka za usne 100"
"86027861";"Aura rezač "
"3830001290394";"Afrodita TI&TI krema za kosu 75ml"
"4250947562840";"Catrice Velvet Matt ruž za usne 010"
"800897825706";"NYX Professional Makeup Senka za oči Hot Singles 06-Bad Seed"
"3838824258553";"Taft Looks V12 gel za kosu 150ml"
"5201314304302";"Tub o Flo pročišćivač sa hladnom vodom"
"8029241115504";"​​​​​​​Disney spiderman dečiji tečni sapun 250ml"
"3600523339020";"LÓreal Paris Infaillible Total Cover Palette Korektor"
"5410076562824";"Pantene Color Protect balsam"
"3337871330118";"Vichy Idealia Skin Sleep noćna krema 50ml"
"9000100815000";"Syoss Oleo Intense boja za kosu 4-18 "
"800897126285";"NYX Professional Makeup Olovka za oči Slim Eye 926-Electric Blue"
"8718951131644";"Colgate Naturals Lemon pasta za zube 75ml"
"4008233112398";"Kneipp so za kupanje magičnih boja za decu 2x20ml"
"86039734";"Aura Mat kremasti ruž za usne Matte 639"
"4008233121727";"Kneipp kremasta kupka nežna koža 400ml"
"4005809808020";"NIVEA Cream Soft gel za tuširanje 250ml"
"4251232239935";"Essence Blossom Dreams Chrome olovka za oči 01"
"4008455004099";"Ekspert za fleke rdja & deo "
"8601900407054";"Juvitana kašasti sok od jabuke i mrkve 130g"
"8606017971092";"Still Bio Argan i Aloe vera regenerator za kosu 500ml"
"8717644461068";"Signal White now pasta za zube "
"4008576314626";"Titania turpija polish blok"
"800897140830";"NYX Professional Makeup Metalik gliter 02-Darkside"
"7702018365319";"Gillette Blue Sensitive pena za brijanje 250 ml"
"4056800619696";"Wellaton 6/77 maxi single farba"
"86034722";"Aura mat ruž 620"
"4003583184415";"Fruttini krema za ruke Experimental Mango"
"800897017835";"NYX Professional Makeup Korektor u olovci Gotcha Covered 13-Sand"
"5015833303971";"Creightons keratin pro-regenerator za kosu 250ml"
"8003350516940";"Logex gumene rukavice"
"3052503824109";"Bourjois Contour Clubbing 41 olovka za oči"
"800897155308";"NYX Professional Makeup Sjaj za usne Lip lingerie gloss 06 - Butter"
"3600531402044";"Maybelline New York Superstay PhotoFix tečni puder 034 Soft Bronze"
"688575003659";"Cerruti 1881 Edt Man muški parfem 100ml"
"4103040135025";"Sebamed Clear Face gel protiv akni"
"9000101046946";"Fa Xtreme Power dezodorans 150ml"
"4008576375290";"Titania zaštitni losion za stopala 75ml"
"86032636";"Aura sjaj Glossy 75"
"8606017878100";"LLUMS pečene senke Pale Pink"
"4008576316996";"Titania češalj dečiji"
"3522930000075";"Caudalie mleko za čišćenje lica 200ml"
"8691190856182";"Golden Rose Longstay Liquid Matte ruž za usne 18"
"8009518171051";"Deborah 24 Ore vodootporna maskara za oči"
"8411061806906";"Carolina Herrera Africa EDT ženski parfem 100ml"
"86034517";"Aura Amazingly Resistant lak 420 "
"5202663183013";"Farcom Profesional Color Cream 100 boja za kosu"
"3600523530953";"L'Oreal Paris Infaillible primer Anti-fatigue"
"800897841393";"NYX Professional Makeup Ruž za usne Full Throttle 06-Night Crawler"
"5201314080466";"Orzene šampon za lomljivu i tanku kosu 400ml"
"4017645040656";"Logona gel za čišcenje masne kože 100ml"
"3600541032798";"Garnier Deo Mineral Invisi CoolRoll-on"
"8008843128327";"ESI Erbaven gel Troxerutin 2% 100 ml"
"8009518164961";"Deborah 05 sjaj za usne"
"8606013472128";"STR8 Oxygen poklon set"
"309974677073";"Revlon Colorstay tečni puder za normalnu i suvu kožu 250"
"5010415470102";"Tommee Tippee Explora šolja, 250 ml, 6m+"
"8691190860028";"Golden Rose Ice Chic lak za nokte 02"
"8691190856243";"Golden Rose Longstay Liquid Matte ruž za usne 24"
"91000000329";"Revlon lak za nokte 270"
"4015600623265";"Blendamed Mouthwash pasta za zube"
"4059729030634";"Catrice senka za oči stix 050"
"8001090595652";"Old Spice Bearglove muški dezodorans u spreju 150ml"
"3838980807251";"48 Zaštitna krema za lice i telo 150ml"
"8606014799552";"Mamma&Baby vlažne maramice 20 komada"
"3661434001871";"Uriage isofil bogata krema za lice 50ml"
"4025089079545";"Sante Lemon fresh losion za telo "
"4005900125507";"Nivea Sun Protect & Refresh losion za sunčanje SPF 20"
"8691190860158";"Golden Rose Ice Chic lak za nokte 15"
"4008576017688";"Titania četka"
"8606019174699";"Yesss! grickalica za nokte srednja 1kom"
"4000388172104";"Dove Essentia krema za ruke"
