barkod;naziv
"8594059732088";"Simply You HerbalMed pastile bokvica,majčina dušica i lipa"
"4005800160233";"Eucerin Hyaluron-Filler + Elasticity Dnevna krema SPF15"
"5410076390458";"Aussie Coror Mate šampon za farbanu kosu 300ml"
"8691190834326";"Golden Rose hd powder high definition No.202 "
"3014260099800";"Oral B Ultrathin Gum care silver četkica za zube 1+1 gratis"
"4250743714146";"Raphael Rosalie poklon set Go! for coffee ženski"
"8606014798043";"Velnea krema za depilaciju za normalnu kožu 100 ml"
"9001616381386";"MAM laža Perfect 0m+, silikon"
"8606017876298";"Watte Watte štapići za uši 300kom"
"5413149260214";"Ariel Moutain Spring prašak za veš 400gr"
"3600540999009";"Garnier Color Naturals 5 1/2 farba za kosu"
"8710505046015";"Chicopee Mikrofiber plus krpa - Plava"
"681619800146";"The Balm Cheater maskara za oči"
"5201314089292";"C-thru Cosmic aura Edt 30ml"
"3600541740051";"Garnier Action Control roll on 50ml"
"9000100995382";"Syoss Ceramide šampon za kosu"
"8001841103891";"Head&Shoulders poklon set"
"8717163476789";"Dove univerzalna krema"
"3600531355456";"Maybelline New York Brow Precise Fiber Fill 04 Soft Brown"
"3052503745527";"Bourjois Healthy Mix serum puder 55"
"088300049493";"Calvin Klein Truth ženski parfem EDP 100ml"
"8600102607323";"Aura Explicit farba za kosu 8"
"8001090548085";"Pantene Micellar regenerator za kosu 270ml"
"3337871320751";"Vichy Normaderm tonik za čišćenje lica 200 ml"
"4008576003650";"Titania pinceta Inox"
"3600523399789";"L'Oreal Paris Color Rich Matte 633 Moka Chic Ruž za usne"
"8001090937483";"Head&Shoulders Supreme Repair šampon za kosu 300ml"
"4005808193028";"NIVEA Diamond Gloss Šampon 250ml"
"3850104280085";"Lino voćna kašica jabuka, 130gr"
"8691190960742";"GR Wow Nail Color NO: 74"
"8009518208368";"Deborah 24 Ore ajlajner"
"8718117106738";"Milupa Aptamil 2 800g"
"3274870025280";"Kenzo Madly EDT ženski set (EDT 30ml + losion za telo 50ml)"
"8606102188077";"Richlife Neuro B12 kompleks 30 tableta"
"9000100218023";"Gliss Ultimate Color regenerator za kosu"
"9062300101796";"Hipp voćni desert"
"5901761948929";"Eveline SOS protiv prvih bora serum za lice 18ml"
"3600531084783";"Maybelline Colossal Liner 02 Extra Black olovka za oči"
"3522930001263";"Caudalie Vinoperfect noćna krema "
"5202663210382";"Farcom Fadiam Decoloration powder"
"Pruža osećaj trenutn";"Adidas Adipure ženski dezodorans u spreju 150ml"
"4251232258073";"Essence Fresh&fit awake tečni puder 10"
"8001090468291";"Pantene Smooth&Sleek Oil serum za kosu 100ml"
"8606107738253";"Deverra Relaxikap kapi 30ml"
"8594073177032";"Nutrend Carnitine Mix Berry napitak 750ml"
"4250035288188";"Catrice Kohl kajal olovka za oči 040"
"3600522935414";"L'Oreal Paris Elseve Extraordinary Oil Ulje za oštećenu kosu, 100ml"
"8606017872009";"LLUMS senka 01 Snow Flake (White)"
"3137370183822";"Nina Ricci Love in Paris EDP ženski parfem 50ml"
"681619700231";"The Balm Overshadow Work is overated pigmenti senki"
"663350059618";"Angry Birds dečiji šampon i gel za tuširanje 300ml"
"5901330038105";"Olimp Gain Bolic Čokolada protein 1 kg"
"8002410042245";"Borotalco Nutriente tečni sapun"
"8001090017772";"Fairy Original All in one kapsule za sudove 60kom"
"3337871325275";"Vichy Ideal 35 krem puder"
"4059729036865";"Essence I need a miracle! Volumizing&strengthening maskara 01"
"4005900022806";"Nivea Express Care hidratantna krema za ruke 100 ml"
"8002410003529";"Toaletni sapun – 3 + 1 gratis"
"3614221717011";"Rimmel set super gel 042 + top coat "
"8600931005550";"Revita Derm Revitalizujuća dnevna krema za suvu kožu"
"8691190643041";"Golden Rose Ice color nail lacquer No.104 lak za nokte 6ml"
"681619700521";"The Balm Cabana Boy rumenilo"
"3850105160720";"Arf Cream Original abrazivno sredstvo za čišćenje 450ml"
"8691190560270";"Golden Rose Rich Color lak za nokte"
"3600530910960";"Maybelline Brow Drama maskara za oblikovanje obrva, tamno braon"
"4005808761678";"Nivea Hair Care pure impact šampon"
"737052769110";"Bruno Banani Absolute EDT muški parfem 50ml"
"8606017872252";"LLUMS Wet Lips sjaj - 02 Sweet Marshmallow (Creamy Rose)"
"3870075004039";"Wetplast Profesional kese bez trake, 20 komada"
"8606017871477";"LLUMS Lak za nokte - GE Tenderness"
"8691190560614";"Golden Rose Rich Color lak za nokte"
"4001638088312";"Weleda Piling za telo od breze"
"3086123363786";"Bic Flex 3 Comfort B of 3"
"86034340";"Aura Up To 10 Days lak"
"8606019894528";"Velnea Kids lak za nokte Green "
"8051403105870";"Lilly čarape 15 Den Platinum 5"
"8606014383867";"Paw Patrol set za dečake "
"3600530559503";"Maybelline Color Sensational ruž 250"
"3264680004087";"Nuxe Reve De Miel veoma hranljiv balzam za usne 15 gr"
"8606017876526";"LLUMS ajlajner crni"
"8008970006116";"Tesori Di Oriente Tiare ženska toaletna voda 100 ml"
"8009518332759";"Deborah olovka za usne Lip liner 14"
"9000100695800";"Syoss Antigrease šampon za kosu"
"8606019174491";"Velnea Porfessional šampon za sjaj bojene kose 250ml"
"8009518284195";"Deborah gel effect lak za nokte 91"
"4059729020970";"Essence Insta perfect tečni puder 80"
"8691190069216";"GR Wonder Lash Mascara "
"3871267027867";"Ovnak Četka za kosu Z 75-2554 Z"
"3337871316624";"Vichy Dermablend 45 puder"
"9005800292885";"NIVEA SUN set (hidrantni losion za sunčanje SPF 30 + NIVEA majica)"
"5000347084065";"Sensodyne konac za zube"
"8008970007090";"Tesori Orhideja gel za tuširanje"
"8691190960384";"GR Wow Nail Color  NO: 38"
"8606107367156";"Aura Velvet Matte puder 315 "
"8001090197535";"Head&Shoulders Total Care šampon za kosu 225ml"
"3870128006690";"Violeta Baby Vlažne maramice sa bademom 56 komada"
"5902704130111";"Glamour šnale za kosu 413011"
"800897139438";"NYX Professional Makeup Olovka za usne Slim Lip 857-Nude Beige"
"8606019171162";"Yesss! Kišobran teget L177- Dark blue"
"3600541094154";"Garnier Mineral Men dezodrans"
"4250035200593";"Essence 02 olovka za obrve"
"8606019170332";"Yesss! Ukrasna kesa za decu mala pčelica"
"8691190466077";"GR Velvet Matte Lipstick NO: 07"
"86033855";"Aura Shine Excess ruž za usne 751"
"88300196869";"Calvin Klein IN2U EDT  ženski parfem 150ml"
"2286142600003";"Pretty eyes monthly sočiva Dark blue"
"4056800657490";"Wellaton 8/74 maxi single"
"8606107694047";"Vulkan kutija mala - srećni praznici"
"3700281702385";"Topicrem nežni rastvor za čišćenje lica"
"7322540575453";"Libresse Natural Care dnevni ulošci"
"7310790088403";"Libresse Goodnight higijenski ulošci"
"9000100212359";"Perwoll Color Magic deterdžent za veš"
"8001090595195";"Old Spice Bearglove antiperspirant muški dezodorans u spreju 150ml"
"8606019893880";"Faro farba za kosu 5.3 čokolada"
"7702018480555";"Gillette poklon set (Match 3 brijač + 2dopune + postolje)"
"882381043063";"Darphin korektivna krema protiv bora oko očiju 15ml"
"3401340106914";"Bioderma Atoderm Preventive krema za suvu i osetljivu kožu 200ml"
"8606014799569";"Mamma&Baby vlažne maramice 64 komada"
"8606014794113";"Home&Family višenamenska krpa za čišćenje 3 komada"
"8606017876397";"Velnea šampon za suvo pranje kose 50ml"
"681619700255";"The Balm Overshadow If you are rich I am single pigmenti senki"
"8001841028927";"Old Spice poklon set"
"8009518073195";"Deborah Comfort Mat 01 puder"
"LP12";"VZK Mleko za skidanje šminke 150 ml"
"96091258";"Max Factor Gel Shine Glossfinity Sprk Berry 55"
"8691190842376";"GR Vision Lipstick   NO: 137"
"96137130";"Dove roll on Pear Aloe Vera 50ml"
"8691190643164";"Golden Rose Ice color nail lacquer No.116 lak za nokte 6ml"
"4084500159297";"Max Factor Skin Luminizer Fnd 80 Bronze"
"8009518112818";"Deborah 24 Ore 5 tečni puder"
"3600530316014";"Maybelline Hydra Extreme ruž 563"
"8002030113776";"Pronto Multisuperficie sprej protiv prašine"
"8710908437304";"Dove Nourishing Oil gel za tuširanje 500ml"
"4084500290600";"Pantene Smooth&Sleek šampon za kosu 360ml"
"8691190643324";"​​​​​​​Golden Rose Ice color nail lacquer No.132 lak za nokte 6ml"
"86034593";"Aura Amazingly Resistant lak 428 "
"5902704990609";"Intervion četka za kosu "
"8005610408101";"Max Factor Smokey Eyemat Dramakit Hypnotic Jade 40 senka za oči"
"8001280301070";"Felce kupka fresco"
"96030240";"Dove Natural Touch roll on"
"3337871319144";"Vichy Purete Thermale mleko za čišćenje lica 3 u 1 200 ml "
"4005809814700";"NIVEA Color Care & Protect Šampon 250ml"
"3661434005923";"Uriage Xemose ulje za kupanje 500ml"
"3600010006831";"Garnier Fructis Strength&Shine 2 u 1 Šampon za kosu 250 ml "
"3614223593804";"Rimmel 60 Seconds lak za nokte 807"
"3859889505970";"Tips podizač pete 41-46"
"3871267027881";"Ovnak Četka za kosu S 148-2213 C"
"3600542110440";"Garnier Color Sensation Vivids Fiery Burgundy Boja za kosu"
"4008576315258";"Titania četka za kosu-velika"
"8691190856236";"Golden Rose Longstay Liquid Matte ruž za usne 23"
"8714789873169";"Palmolive Naturals Black Orchid pena za kupanje 650 ml"
"8691190066475";"GR Perfect Super Volume & Lenghtening Mascara"
"3600523187430";"L'Oreal Paris Brow Artist Sculpter 01 Blonde"
"3614225979927";"Bourjois Rouge velvet the lipstik ruž za usne 018"
"8011530905002";"Gianfranco Ferre In The Mood For Love Pure EDT ženski parfem 50ml"
"4251232281972";"Essence Colour up shine ruž za usne 06"
"4084500605602";"Max Factor Smoke Eye Drama Shad 05 Magnet Jades"
"800897139582";"NYX Professional Makeup Olovka za oči Slim Eye 932-Bronze Shimmer"
"3838824184203";"Palette Icc  boja za kosu W5 Nougat "
"3600523503285";"L'Oreal Paris Paradise Extatic Maskara"
"8607000076381";"Gracinia Gambogia"
"5901086000104";"Teekanne Nana čaj"
"8009518138627";"Deborah 24 Ore 286 olovka za obrve"
"8606017971290";"Still Fruity Color 6.66 Koralno crvena farba za kosu"
"4008576375016";"Titania gumica za kosu 6kom 7928"
"4001638080132";"Weleda Blago mleko za čišćenje lica"
"9000100921060";"Palette Perfect Care Color boja za kosu 770   "
"4008576010061";"Titania pinceta"
"3600550305074";"Mixa hidratantna nega za bebe, 100ml"
"8606017873518";"Velnea Clear&Safe dezodorans u spreju 50 ml"
"8005610554990";"Bruno Banani No limits Woman Edt 20ml"
"4001638075114";"Weleda pomorandža šampon i gel za tuširanje 150ml"
"9000101043211";"Got2B Extrafresh šampon za suvo pranje kose 200ml"
"5000204522884";"Glade Sense & Spray - dopuna đurđevak"
"4005808765157";"NIVEA MEN Power gel za stilizovanje kose 150ml"
"4084500413269";"Ariel Mountain Spring tečni deterdžent 1.3L"
"4017645033085";"Logona Age Protection noćna krema  "
"86036764";"Aura Wing It Up tečni ajlajner za osetljive oči"
"5054563009937";"Aquafresh Intense Clean Whitening pasta za zube"
"3614224103002";"Bourjois Rouge de Velvet ruž za usne 11"
"4005808231102";"NIVEA Double Effect sprej 150ml"
"5901086049202";"Teekanne Cherry Berry čaj"
"8606013470223";"STR8 Unlimited poklon set"
"5011417564110";"Airwick mirisni štapići 30ml"
"86030366";"Aura veštačke trepavice 09"
"3574660716771";"Neutrogena Nordic Berry losion za telo"
"8710447367711";"Dove Anti stress gel za tuširanje sa micelarnom vodom 250ml"
"8058664009916";"Chicco makazice za nokte, roze"
"800897016807";"NYX Professional Makeup Tečna senka za oči 02-Rose Pearl"
"8001090208576";"Lenor Fresh Meadow omekšivač za veš 1l"
"8606017878179";"LLUMS četkica za tečni puder F03 1kom"
"8691190842208";"GR Vision Lipstick   NO: 120"
"4059729023735";"Essence Melted chrome tečni ruž za usne 01"
"8691190990022";"GR Waterproof Automatic Eyeliner NO: 02"
"96099292";"Max Factor Creme Puff Blush Seductive Pink 15"
"9000100632744";"Syoss boja za kosu 4-1 Middle brown "
"9000100920445";"Palette Perfect Care Color boja za kosu 900   "
"800897829988";"NYX Professional Makeup Tečni mat ruž za usne 20-Copenhagen"
"4059729039378";"Essence Glitter on glitter off peel off lak za nokte 02"
"8606011748964";"L - Carnatine 500 kapsule"
"663350065343";"Frozen gel za tuširanje 300ml"
"3337872413032";"La Roche Posay Rosaliac AR Intense krema za lice 40ml"
"4002448116585";"Scholl Velvet Smooth Saida električna turpija za pete sa dijamantima Pink"
"4005808805181";"Nivea Baby silk šampon 200ml"
"8606107367767";"Aura olovka za usne lipliner 62"
"86034937";"Aura Glorious Cheeks rumenilo 225"
"085805147549";"Elizabeth Arden Green Tea Honeysuckle EDT ženski parfem 100ml"
"86036948";"Aura Revolution 15 Say Yes olovka za usne"
"8606107900025";"Biomelem šampon Moć cveća regeneriše 222ml"
"7612412156003";"Curaprox CS 1560 Soft četkica za zube"
"9587200114";"Baby banana glodalica žuta"
"4056800895182";"Wellaton 2/0 Black farba za kosu"
"86034098";"Aura Cover Me korektor 152"
"3574660089295";"Ob Super tamponi 8 komada "
"5900020000941";"Nesquik žitarice 250 gr"
"800897098339";"NYX Professional Makeup Paleta za konturisanje lica 3 Steps To Sculpt 02-Light"
"3838824081953";"Palette Delux boja za kosu 218 Srebrno plava"
"783320922176";"Bvlgari Omnia Crystalline EDP ženski 40ml"
"3337871321574";"Vichy Liftactiv Flexilift 35 tečni puder"
"8009518234411";"Deborah 7 Days 860 lak za nokte"
"8691190120795";"Golden Rose Lip Barier - transparent olovka za usne"
"4008233133805";"Kneipp kremasta kupka jednostavna nežnost 400ml"
"8606017872290";"LLUMS Wet Lips sjaj - 06 Caffe Latte"
"800897826130";"NYX Professional Makeup Senka za oči Hot Singles 49-Turnt Up"
"800897085339";"NYX Professional Makeup Olovka za obrve 01-Blonde"
"86039673";"Aura Mat kremasti ruž za usne Matte 633"
"5901761966718";"Eveline Oh my lips liquid tečni ruž i olovka za usne 05 Red Passion"
"8606105480567";"MOE28 Super Sensitive dnevni ulošci 20 komada"
"3600523387755";"L'Oreal Paris Colorista Spray 2 Pastel Blue "
"309976740058";"Revlon ColorStay Olovka za oči NO:205"
"3337871330569";"Vichy Purete Thermale tonik za lice 200ml"
"86033657";"Aura Correct Me korektor 306"
"4008600074274";"Nuk FC cucla silikon"
"3600523330102";"LÓreal Paris Micelarna Voda Soft 400 ml "
"3600523560899";"L'Oreal Paris Woke up like this tečni hajlajter"
"9005800307121";"NIVEA Sunshine Love summer set "
"5201314054511";"BU Sensitive mini ženski dezodorans 50 ml"
"5943048004744";"Bioten Genovate dnevna krema za lice protiv bora 50 ml"
"5201314356547";"BU Wild Revival Natural ženski sprej za telo 75 ml"
"8606017870548";"VZK serum sa hijaluronskom kiselinom 30ml"
"3600523498482";"L'Oreal Paris Revitalift Filler noćna maska 50 ml"
"8001280030109";"Felce Azzurra profumato omekšivač"
"8606019173098";"LLUMS set za obrve 1"
"3052503410609";"Bourjois 3D sjaj za usne 06"
"8710447273630";"Rexona Sport muški gel za tuširanje 250ml"
"3600541595248";"Garnier Skin Naturals Micelarna voda 400 ml"
"9000100985109";"Schauma 7 Blossom Oil šampon za kosu, 250ml"
"8008970047522";"Wash&Go Micelarna voda balzam u spreju 200ml"
"859236007952";"Veet bikini i pazuh trake za depilaciju"
"9005800259260";"NIVEA micelarna voda za suvu kožu 200ml"
"3430750034593";"Jeanne en Provence Lavender & Vetiver Edt 100ml"
"800897840228";"NYX Professional Makeup Tečni kremasti ruž za usne Suede 02-Life's A Beach"
"3661434005329";"Uriage Xemose krema za telo 400ml 1037 + gratis ulje za kupanje 200ml"
"4062300241558";"Hipp testenina -123 u krem sosu od bundeve, 250g"
"3661434004858";"Uriage Xemose krema za telo 400ml"
"96109731";"Max Factor Lipfinity Longlasting Ever Sumptous 25"
"3661434002656";"Uriage hyseac losion za lice 200ml"
"335118";"Lifeline urobalans caps. A20 1+1 gratis"
"4059729037428";"Essence melted chrome senka za oči 06"
"800897826321";"NYX Professional Makeup Senka za oči Hot Singles 68-Flustered"
"3326240036690";"Ulric De Varens mini Dream toaletna voda 25ml"
"3607347887065";"Rimmel Exaggerate 212 olovka za oči"
"8606017876380";"LLUMS Lip Loving ruž za usne - 12 Boudoir Violet"
"50081998";"Max Factor Mastertouch Beige 309"
"309978392705";"Revlon ColorStay Ultimate ruž za usne NO: 070"
"9000101214529";"Nature Box Macadamica gel za tuširanje 385ml"
"3522930001713";"Caudalie ulje za skidanje šminke, 100ml"
"3856007900099";"Rosal Lip Balm Sensitive balsam za usne"
"5907609336200";"Eveline Bio Hijaluron 4D Eye Cream"
"4084500523036";"Lenor Ocean Fresh omekšivač za veš"
"4251232282825";"Catrice Rock couture tečni ajlajner 030"
"8009518067408";"Deborah 13 Milano Red ruž za usne"
"3600523176243";"L'Oreal Paris Infallible Blush Trio 201 Soft Rosy rumenilo"
"3574660723335";"Johnsons Baby vlažne maramice"
"9062300133117";"Hipp BIO kašica Banana sa grizom i kakaom 190gr"
"3337875485142";"Vichy Dercos Serum 60ml"
"800897019150";"NYX Professional Makeup Senka za oči Prismatic 15-Savage"
"8005610255835";"Bruno Banani Womens Best EDT ženski parfem 20ml"
"3052503707327";"Bourjois Volume Glamour Push Up maskara za oči 73"
"5012874101009";"Rimmel Exaggerate 001 tečni ajlajner"
"3086126608969";"Bic Twin Lady Sensitive ženski brijač 5kom + gratis 1kom"
"3831070652663";"Afrodita Sun Care mleko SPF30 200ml"
"3858881242029";"Bio – C 500 "
"4251232255874";"Catrice Art Couleurs senka za oči 130"
"8002340011809";"Strep krema za depilaciju tela"
"8606107248066";"Citrax forte kapsule za mršavljenje"
"3600523385430";"L'Oreal Paris Colorista Paint 3.66 "
"8606104556799";"BetaTen protekt"
"3600523527182";"L'Oreal Paris Brow Artist Micro Tattoo olovka za obrve 107 Cool Brunette"
"8005610433646";"Max Factor Healthy Skin Harmony Mir 90 Toffee puder za lice"
"4250587753936";"Catrice dugotrajna olovka za usne 080"
"800897840242";"NYX Professional Makeup Tečni kremasti ruž za usne Suede 04-Soft Spoken"
"3508240002473";"Lierac Deridium set"
"3614220617091";"Rimmel 60 seconds 510 lak za nokte"
"5013965382062";"Max Factor 2000 Calorie Black 01 Vodootporna"
"9007253101479";"Bebivita nektar šljiva i jabuka 200ml"
"3600542115001";"Garnier Botanic Therapy Green Tea Šampon 250ml"
"42269830";"NIVEA Care univerzalna krema 200ml"
"5000204560862";"Glade Sense & Spray dopuna jabuka i cimet osveživač prostora 18 ml"
"85805180218";"Elizabeth Arden Green Tea Bamboo Edt Spray 100ml"
"8003350531400";"Logex plave kese za smeće 120L 10kom"
"8606017875161";"Yesss! gumica za kosu sa ukrasnom šnalom"
"8710103645825";"Premium Magična Šolja 340 ml (crna, plava, roze)"
"8606017872054";"LLUMS senka 06 Wild Rose (Rose)"
"4047400470350";"Sensodyne Fluoride pasta za zube"
"7640168930424";"Biomed Charcoal pasta za zube 100g"
"5901086400119";"Teekanne Kamilica čaj"
"9000100512091";"Syoss Repair tretman za kosu"
"8691190120726";"Golden Rose Correct & Conceal Concealer Cream palette 02"
"8002410033885";"Neutro Roberts Calendula intimni sapun 250ml"
"3700306918265";"Couleur Caramel Bio mineral Loose puder u prahu 06 Light brown"
"3838945502634";"Frutek jabuka i kamilica čaj 125ml"
"4015400481928";"Naturella Calendula dnevni ulošci"
"8003350501229";"Logex sunđer za sudove"
"8693495034029";"Palmolive sapun Aloe&Olive 3+1 gratis"
"8009518325744";"Deborah lak za nokte 10 days long 849"
"5906735233063";"La Rive Deo dezodorans "
"8411061720066";"Carolina Herrera Ch L'eau EDT ženski parfem 50ml"
"3831070652199";"Afrodita Red Grapes gel za tuširanje 250ml"
"96021132";"Max Factor Colour Elixir LS 825 Pink Brandy"
"8606017871880";"Pro-B-Active Probiotik za decu Bulardi 10 kapsula"
"3614224874230";"Bourjois regular blush duo pot rumenilo 001"
"86038195";"Aura silikonski aplikator za nanošenje tečnog pudera 1kom"
"800897826482";"NYX Professional Makeup Senka za oči Hot Singles 84-Own The Night"
"5201314022770";"Carroten krema za umirivanje opekotina"
"309974677028";"Revlon Colorstay tečni puder za normalnu i suvu kožu 150"
"8691190960155";"GR Wow Nail Color  NO: 15"
"9005800262048";"NIVEA Protect & Care sprej 150ml"
"5902704154568";"Intervion Silver četkica za senku 415456"
"50683338";"Max Factor Lasting Performance Natural Beige 106"
"9062300127406";"Hipp krompir, jabuka i cvekla sa govedinom"
"8711600793101";"Dove Shea butter gel za tuširanje 250ml"
"3360375004049";"Armani Code EDP woman 30ml"
"5201314079231";"Bu In Action Pure&Dry dezodorans u spreju 150ml"
"3337875552066";"Vichy Slow Age dnevna nega protiv starenja kože lice 50ml"
"9062300101482";"Hipp banana i breskva u jabuci"
"3614224898298";"Bourjois Healthy mix puder 003"
"8691190608118";"Golden Rose 11 senka za oči u olovci"
"4062300001312";"Hipp banana i kivi"
"3386460013635";"Burberry The Beat Men EDT muški parfem 30ml"
"3600541060746";"Garnier Exstreme Men dezodorans"
"0618059109843";"PhytoColor farba za kosu 5"
"5900627021721";"Cillit Lime & Rust univerzalno sredstvo"
"309978854050";"Revlon Clolorsilk 05 farba za kosu"
"3052503300818";"Bourjois olovka za usne 8"
"8691190694821";"Golden Rose Concealer & Corrector Crayon 02"
"3337871320744";"Vichy Normaderm gel za čišćenje lica 200 ml"
"9000101020144";"Somat All in One tablete 65 komada"
"8606003060052";"Filter čaj kamilica"
"4008666701251";"Plantur 39 šampon za kosu 250 ml"
"8009518222241";"Deborah Milano 07 ruž za usne"
"5052197027969";"Scholl dnevna hidrantna krema za stopala 60 ml"
"8008970040240";"Vidal Mlečna kiselina intimna kupka 250ml"
"8436551470986";"Lovium Sexy ženski dezodorans u spreju 200ml"
"3600531322120";"Maybelline Vivid Matte ruž za usne 25"
"9005800283913";"NIVEA losion bogat uljem sa mirisom ruže i arganovim uljem 200ml"
"4260379939264";"Precious Argan Oil Repair tretman za kosu"
"8606017870388";"VZK Losion za čišćenje lica 150 ml"
"3052503705149";"Bourjois Glamour Definition maskara"
"30096592";"Maybelline New York Fit Me korektor 15"
"8711600360525";"Cif Ultra White abraziv"
"9000100779326";"Persil Power gel deterdžent za veš"
"5310001919184";"Becutan vlažne maramice"
"30056671";"Dove Silk Dry dezodorans stik 40ml"
"30095724";"Essie 70 lak"
"681619800634";"The Balm Instain Lace rumenilo"
"8691109285911";"Tref Line kratke čarape monster high veličina 11"
"3337875491907";"La Roche Posay Anthelios krema sa zaštitom od UVA zraka SPF50+ 50ml"
"737052778341";"Escada Joyful Edp Woman ženski parfem 75ml"
"3600531355463";"Maybelline New York Brow Precise Fiber Filler 05 Medium Brown"
"5038483588710";"Scholl Active Repair krema+ za ispucale pete 60 ml"
"3600541561106";"Garnier Olia 10.21 farba za kosu"
"5901887030881";"Ziaja na bazi ekstrakta krastavca tonik za lice 200ml + 1 gratis"
"4059729011015";"Catrice Ultimatte matt ruž za usne 100"
"8691190157029";"GR Terracota Blush On NO: 02"
"8606017875246";"Yesss! Elastična gumica za kosu sa ukrasnom šnalom"
"8691190608026";"Golden Rose 02 senka za oči u olovci"
"4251232258585";"Essence Vibrant Shock lip paint ruž za usne 04"
"9007253104555";"Bebivita šljiva 190g"
"8008970008776";"Tesori Zmajev cvet gel za tuširanje"
"3337871325251";"Vichy Ideal 15 krem puder"
"8691190965860";"Golden Rose So cute intense volume definition&lift up maskara"
"8710505046077";"Chicopee Mikrofiber plus krpa - Crvena"
"86030311";"Aura veštačke trepavice 04 "
"4008576315913";"Titania pinceta 1077/B Girl kosa"
"8710749580160";"Miss Sporty olovka za oči"
"8411126019357";"Revlonflex šampon za kosu dry, 650ml"
"3830029294664";"Parodontax Extra Fresh pasta za zube"
"4005800062520";"Eucerin Dermo Purifyer Piling gel "
"800897826468";"NYX Professional Makeup Senka za oči Hot Singles 82-Top Notch"
"9005800264110";"NIVEA SUN hidrantni losion za sunčanje SPF 30"
"9000101039788";"Fa gel za tuširanje Honey Creme 250ml"
"4005900185259";"8x4 Pure ženski dezodorans u spreju"
"8606017870982";"Velnea Body brijači za jednokratnu upotrebu sa dve oštrice, 5 komada"
"800897109172";"NYX Professional Makeup Olovka za oči Slim Eye 917-Purple"
"737052979281";"Christina Aguilera Touch of Seduction EDP ženski parfem 30ml"
"5000204844269";"Glade mirisna sveca, Dazzling Blossom W15 120g"
"8058664008803";"Chicco omekšivač nežni cvetni miris 750ml"
"800897093228";"NYX Professional Makeup Paleta metalik senki za oči Cosmic Metals  "
"91000009148";"Revlon lak za nokte 570"
"0070330704176";"Bic 1 Sensitive HC 36"
"86034135";"Aura Take Care of Me puder 801"
"8056777028824";"Pompea Alvina Lime Unica čarape"
"3600541739994";"Garnier Action Control Thermic dezodorans"
"4005800024405";"Eucerin UreaRepair Plus Losion sa 5% uree"
"3830001298284";"Afrodita Šampon za kosu i telo Kokosovo mleko 1000 ml"
"3838980515378";"Subrina Charm 66/4 farba za kosu"
"8606011740588";"Propomint sprej-AH DAH"
"8711600447721";"Cif Sprej za kuhinju"
"5900095011484";"Presto maramice za čišćenje drvenih površina"
"4015600805500";"Mac Factor Excess Longwear Eyeliner 06 Brown"
"3031449639718";"Killys grickalica za nokte"
"4605543004438";"ZOO VIP šampon i regenerator"
"3700306911006";"Couleur Caramel senka za oči 100 Pearly Fatale"
"9000100860123";"Fa Vitamin E & Kick Guave gel za tuširanje"
"5000204746013";"Raid super zamka za mrave"
"5011321218727";"Max Factor Masterpiece Deep Blue 4 maskara"
"9000101055924";"Schauma šampon za kosu Mediterian olive oil&aloe vera 400ml"
"309976348452";"Revlon Just Bitten Balm stain Ruž u olovci NO:045"
"86006859";"Lakorastvorljivi vitamin C 1000"
"3504108030749";"Mustela 2u1 šampon za pranje kose i tela, 200ml"
"3700306910818";"Couleur Caramel senka za oči 081 Matt Intense Brown"
"5201314054412";"STR8 Rebel dezodorans u spreju 150ml + 50ml"
"4251232221602";"Essence Volume Stylist 18h Lash Extension maskara "
"3574660089202";"Ob Normal tamponi 8 komada"
"3401321340351";"Bioderma Sebium Al tonirana krema korektor 30ml"
"3600541752078";"Garnier Action Control roll on 50ml"
"4084500224445";"Max Factor Masterpiece Mascara Transform Black"
"8022297013350";"Alfaparf farba za kosu am protiv žutog odsjaja 150gr"
"8411126039645";"Revlon hydrating losion za telo 400ml"
"4251232222135";"Essence My Must Haves paleta za pojedinačne senke "
